Bios,Movies,TV,Religion,Music,Sports,Books,Politics,Cluster #
internet junkie passionate tv enthusiast troublemaker amateur writer twitter buff coffee geek web fan food advocate music maven,8,7,5,1,8,5,8,220
proud problem solver general music specialist social medium maven creator web fanatic twitteraholic troublemaker,8,5,7,1,0,1,5,0
wannabe bacon trailblazer zombie fan twitter enthusiast creator tv maven certified student,0,4,4,1,2,2,0,0
tv buff reader evil writer creator twitter advocate bacon specialist avid music scholar,0,7,5,5,5,6,6,0
certified travel ninja evil bacon specialist introvert lifelong tv fanatic typical explorer,0,3,2,8,6,6,3,0
beer nerd analyst food fan internet enthusiast incurable tv scholar social medium fanatic,6,7,7,2,5,3,6,0
web nerd total creator food fanatic devoted tv advocate zombie aficionado writer music evangelist,1,4,6,8,8,5,4,0
travel aficionado food ninja lifelong beer buff organizer wannabe analyst award winning coffee junkie entrepreneur freelance creator,6,0,4,1,5,8,4,249
pop culture maven coffee specialist beer aficionado general communicator devoted internet advocate student,6,8,6,1,1,1,2,0
communicator amateur social medium scholar tv guru internet fanatic analyst beer enthusiast,4,6,3,2,7,3,8,0
infuriatingly humble web practitioner zombie fan tv scholar alcohol specialist writer beeraholic,5,8,9,0,7,0,1,0
professional web fan extreme food trailblazer writer travel geek student zombie expert,7,7,2,3,0,4,2,0
troublemaker alcohol enthusiast avid music ninja beer specialist infuriatingly humble tv scholar zombie evangelist,2,6,4,6,9,1,8,0
coffee maven wannabe analyst amateur zombie specialist internet evangelist creator general entrepreneur lifelong communicator,6,3,4,2,0,6,0,0
certified twitter nerd alcohol maven food fan tv trailblazer student unable type boxing glove,5,3,2,9,1,7,9,0
beer maven professional social medium fanatic tv nerd zombie buff internet aficionado organizer,1,6,4,6,9,3,1,0
zombieaholic coffee geek pop culture guru bacon aficionado twitter fanatic internet practitioner thinker,6,3,1,6,7,2,5,0
certified gamer unapologetic alcohol buff friendly food fanatic general beer expert tv guru reader fall lot student,3,9,9,5,5,1,2,398
devoted beer nerd general problem solver thinker hipster friendly travel fan amateur student zombie ninja,4,3,4,0,7,3,5,308
hipster friendly student incurable explorer award winning pop cultureaholic internet fan,5,7,9,7,3,0,3,0
total coffee maven friendly web nerd organizer food geek bacon aficionado introvert,4,4,3,3,2,3,0,0
coffee expert internet lover twitter maven wannabe reader web scholar travel trailblazer,2,8,3,7,4,8,3,0
unable type boxing glove troublemaker twitter maven social medium guru tv advocate travel enthusiast,1,6,0,5,2,6,2,0
internet advocate alcohol nerd hipster friendly creator pop culture aficionado food fan,1,4,1,4,0,5,5,0
total music geek infuriatingly humble zombie scholar coffee fanatic alcohol specialist beer trailblazer,0,2,0,9,6,5,4,0
bacon evangelist internet fanatic alcohol advocate music lover food aficionado zombie ninja travel scholar pop culture nerd twitter geek web maven,1,6,0,6,6,8,0,1
bacon fan food guru student coffee maven twitter junkie web evangelist total reader prone fit apathy,7,7,3,3,8,6,9,0
tv junkie pop culture geek avid twitter practitioner devoted analyst alcohol fanatic,2,1,6,1,8,3,0,0
award winning writer analyst social medium ninja freelance beer geek web guru student,6,6,1,2,1,0,4,0
professional music guru hardcore explorer coffeeaholic wannabe web trailblazer,4,0,8,8,4,1,2,0
wannabe pop culture practitioner student web fan tv advocate food junkie entrepreneur,4,9,4,2,0,0,6,0
devoted social medium enthusiast tv geek travel advocate twitter nerd zombie specialist,8,8,8,3,5,0,4,0
food maven general reader writer wannabe troublemaker tv lover professional gamer bacon enthusiast zombie buff,4,8,4,9,3,9,4,0
zombie practitioner web enthusiast beer evangelist alcohol aficionado amateur troublemaker,2,2,4,4,6,7,7,0
writer creator introvert entrepreneur internetaholic zombie nerd incurable beer geek,7,8,7,0,5,6,4,0
certified student unable type boxing glove total analyst proud explorer beer guru travel enthusiast,8,3,5,3,7,3,3,0
total alcohol guru music ninja organizer student problem solver avid social medium fan,9,5,3,3,5,9,6,0
pop culture advocate creator proud travel lover problem solver alcohol trailblazer award winning beer practitioner,6,6,1,0,6,1,8,0
explorer organizer troublemaker fall lot twitter specialist general introvert entrepreneur coffee practitioner web junkie,3,8,1,2,3,3,5,391
unapologetic tv practitioner social medium trailblazer incurable travel expert proud food buff music lover,3,7,9,9,8,3,1,0
internet nerd proud travel advocate gamer coffee geek food enthusiast,8,7,8,5,0,2,0,0
unable type boxing glove future teen idol food advocate devoted travel fan extreme introvert,0,1,4,4,2,0,8,0
hipster friendly writer creator alcohol scholar evil bacon lover hardcore zombie guru,1,7,6,2,8,5,2,0
unable type boxing glove proud problem solver introvert certified zombie lover,1,1,1,0,7,6,2,0
web maven evil reader entrepreneur award winning social medium fan introvert avid organizer,7,6,6,9,5,6,2,0
unable type boxing glove creator infuriatingly humble web nerd organizer beer practitioner,7,2,5,4,3,6,8,0
twitter fanatic subtly charming alcohol guru beer advocate total food maven award winning internet expert,6,2,8,7,5,4,7,0
hardcore bacon geek thinker coffee buff entrepreneur web fanatic zombie expert alcohol junkie,3,1,1,2,3,1,7,0
introvert gamer future teen idol tv specialist web practitioner twitter guru music advocate bacon fanatic student analyst,7,8,8,2,2,1,3,312
unapologetic web enthusiast beer expert troublemaker entrepreneur travel evangelist tv nerd prone fit apathy communicator,4,8,0,9,8,7,9,430
beer expert alcohol specialist proud social medium nerd freelance creator communicator foodaholic problem solver,9,0,2,5,2,9,5,0
alcohol lover creator beer fan pop culture fanatic web maven general thinker incurable student analyst,5,4,0,6,5,3,0,0
beer buff troublemaker social medium junkie music expert professional creator bacon specialist travelaholic extreme writer tv fan,9,4,6,5,4,0,3,621
professional beer trailblazer music maven reader problem solver internet enthusiast,6,6,7,8,6,5,7,0
incurable introvert travel geek extreme thinker explorer wannabe internet aficionado,1,7,7,1,8,8,7,0
proud travel nerd twitter evangelist beer advocate web guru total social medium junkie alcohol aficionado thinker,1,8,5,6,7,2,5,526
troublemaker wannabe twitter scholar analyst bacon geek subtly charming pop culture ninja,2,9,7,8,4,6,6,0
extreme baconaholic thinker freelance music practitioner explorer coffee maven friend animal everywhere,4,8,1,8,5,2,5,0
internet ninja professional coffee evangelist hardcore pop culture nerd zombie advocate,6,6,4,7,3,2,2,0
bacon ninja alcohol lover social medium maven internet geek travel buff unable type boxing glove,1,2,0,7,9,1,1,0
alcohol nerd music advocate hipster friendly internet specialist organizer coffee aficionado,8,9,9,3,3,7,9,0
total food buff thinker friend animal everywhere travel guru bacon junkie,3,1,3,7,2,5,4,0
music lover organizer problem solver devoted bacon enthusiast coffee expert food practitioner,7,1,7,7,5,5,6,0
beer nerd total tv geek music expert communicator passionate thinker internet specialist alcohol trailblazer,3,6,5,3,5,3,6,0
internet scholar twitteraholic pop culture fanatic alcohol lover social medium expert beer buff,7,5,1,7,1,8,6,0
freelance twitter ninja social medium specialist problem solver total student organizer,8,9,8,6,0,8,8,0
professional travel enthusiast writer tv fanatic total student social medium maven food aficionado,3,5,4,4,3,2,4,0
twitter lover avid communicator subtly charming alcohol scholar lifelong food evangelist troublemaker coffee aficionado,1,1,9,8,9,5,6,320
entrepreneur bacon nerd problem solver total web ninja reader analyst introvert,4,1,8,7,4,7,2,0
passionate coffee fanatic wannabe music guru friendly organizer tvaholic beer specialist creator,3,8,3,0,4,6,2,0
pop culture fan writer unapologetic food expert proud twitter specialist bacon scholar thinker,8,9,1,1,4,6,3,0
subtly charming pop culture junkie bacon guru troublemaker coffeeaholic internet practitioner zombie buff,1,4,2,9,8,2,7,0
entrepreneur general bacon fanatic professional twitter nerd devoted social medium junkie alcohol evangelist,4,3,9,9,1,9,1,0
zombie expert twitter scholar travel junkie explorer internet buff total bacon nerd analyst gamer organizer typical troublemaker,5,0,8,1,8,4,1,295
subtly charming internet evangelist thinker twitter fanatic unapologetic writer zombie practitioner evil alcohol aficionado musicaholic entrepreneur,8,6,5,6,6,1,4,0
organizer food fanatic pop cultureaholic certified alcohol specialist general music ninja,6,9,6,7,8,2,0,0
twitter guru student zombie geek internet fanatic food advocate problem solver social medium aficionado reader thinker analyst,3,3,6,4,4,9,5,531
internet enthusiast award winning social medium fanatic thinker lifelong analyst,0,5,8,8,9,5,0,0
tv ninja communicator internetaholic travel junkie hipster friendly entrepreneur,3,6,6,2,5,5,9,0
extreme internet scholar general coffee maven travel geek avid organizer twitter practitioner,3,9,5,6,5,8,4,0
food junkie tvaholic typical music fan evil travel ninja pop culture nerd,0,2,8,1,3,1,0,0
introvert troublemaker internet scholar zombie specialist lifelong bacon nerd beer geek,9,9,9,1,3,2,4,0
internet buff tv trailblazer reader pop culture fanatic zombie aficionado award winning alcohol enthusiast,6,6,0,0,3,6,2,0
tv geek beer enthusiast creator internet fanatic unapologetic bacon buff social medium nerd,8,2,9,4,0,0,4,0
web junkie coffee aficionado certified writer problem solver food lover creator,0,4,2,8,9,2,9,0
twitter evangelist subtly charming tv fanatic professional explorer total social medium lover typical entrepreneur,6,7,6,0,4,8,3,0
twitteraholic writer hardcore thinker internet maven social medium guru communicator,8,8,1,9,3,4,7,0
creator organizer social medium scholar passionate explorer unapologetic travel nerd reader bacon enthusiast subtly charming zombie practitioner,4,6,3,0,0,0,8,587
organizer gamer certified problem solver explorer passionate music fanatic tv aficionado devoted bacon geek coffee maven,7,4,0,9,1,5,3,0
problem solver award winning travel fanatic food scholar devoted thinker web guru twitter enthusiast music junkie,4,6,2,5,9,7,4,433
lifelong social medium maven web enthusiast music aficionado internet advocate zombieaholic,7,0,6,2,2,4,1,0
zombie guru student problem solver evil alcohol buff web trailblazer amateur reader travel junkie tv expert coffee enthusiast,2,7,8,3,3,6,9,329
creator explorer wannabe alcohol specialist twitter enthusiast tv scholar future teen idol,2,5,5,8,0,3,3,0
alcohol lover pop culture trailblazer student tv buff devoted twitter geek,8,2,4,5,9,4,1,0
beer fan tv advocate analyst communicator wannabe social medium expert evil pop culture fanatic web junkie organizer thinker student introvert,6,0,0,3,3,5,0,494
coffee nerd music fanatic beer ninja certified introvert creator tv buff bacon enthusiast,6,4,0,7,6,6,5,0
web nerd coffee fanatic unapologetic internet aficionado beer advocate reader,6,0,2,4,8,8,4,0
music fan hardcore reader communicator pop culture ninja analyst hipster friendly organizer proud zombie fanatic,4,2,9,5,7,4,7,63
coffee expert zombieaholic problem solver gamer music guru award winning twitter advocate passionate troublemaker,0,8,8,0,5,1,3,0
social medium junkie coffee specialist pop culture advocate lifelong creator hardcore beer expert troublemaker subtly charming student,0,9,2,5,2,0,7,0
web specialist social medium maven pop culture lover freelance reader travel geek,9,2,8,8,9,4,1,0
writer beer specialist certified web maven internet buff analyst introvert pop culture expert,6,9,6,1,9,0,8,0
introvert hardcore foodaholic typical beer fan zombie fanatic subtly charming thinker music geek explorer,7,9,1,3,3,6,8,0
friend animal everywhere evil music practitioner pop culture lover alcohol guru zombie fanatic,4,2,7,1,7,5,7,0
gamer devoted explorer total analyst proud music expert beer evangelist coffee trailblazer,4,5,7,9,6,9,2,0
web advocate creator writer fall lot social mediaholic reader alcohol geek student tv aficionado,9,4,2,1,6,1,5,509
gamer avid bacon buff travel fanatic music expert foodaholic thinker student proud reader,9,8,2,0,8,3,8,0
web nerd infuriatingly humble zombie geek analyst music expert wannabe tv advocate,5,7,1,5,5,3,2,0
entrepreneur passionate travel junkie alcohol fan freelance pop culture lover,3,6,6,6,0,1,5,0
friendly zombie aficionado food advocate beer fanatic coffee specialist troublemaker internet ninja reader lifelong communicator,8,9,6,7,1,3,2,0
incurable web nerd wannabe food trailblazer student music ninja social medium enthusiast,3,4,3,1,6,3,6,0
communicator entrepreneur wannabe zombie aficionado freelance beer geek alcohol fan,9,4,1,2,8,3,7,0
devoted zombieaholic wannabe internet advocate food specialist organizer pop culture guru coffee fanatic,0,2,6,4,4,3,0,0
tv evangelist passionate pop culture scholar internet expert devoted zombieaholic music practitioner,3,0,1,8,2,8,1,0
alcohol junkie musicaholic friendly introvert thinker writer explorer,3,6,8,5,5,1,2,0
troublemaker music trailblazer twitter specialist zombie evangelist organizer,2,0,7,1,5,9,8,0
zombie guru music fanatic coffee specialist amateur writer tv advocate passionate entrepreneur travel aficionado,7,6,4,9,4,4,1,0
pop culture trailblazer devoted coffee lover gamer alcohol nerd general student typical music scholar web geek,9,5,9,2,7,8,7,0
infuriatingly humble troublemaker entrepreneur music lover wannabe coffee geek social medium fan,8,2,4,1,1,2,6,0
travel maven music enthusiast writer entrepreneur pop culture expert creator problem solver analyst student,2,7,7,5,3,7,9,0
twitter ninja beer aficionado troublemaker zombie maven entrepreneur webaholic,9,7,3,2,7,6,6,0
bacon evangelist evil zombie nerd freelance social medium fanatic music trailblazer,1,7,7,5,3,4,0,0
lifelong explorer general food lover coffee nerd thinker fall lot tv scholar,7,8,3,7,2,2,5,0
zombie fanatic beer fan hardcore web enthusiast bacon advocate twitter evangelist lifelong alcohol ninja avid tv buff,5,7,7,9,1,3,1,0
evil bacon scholar writer food geek internet junkie communicator zombie aficionado,7,1,7,4,6,8,8,0
social medium fan avid travel fanatic proud tv enthusiast zombie geek analyst,8,7,8,0,3,9,1,0
subtly charming web fanatic zombie nerd communicator pop culture ninja internet junkie,6,6,8,3,8,9,9,0
certified bacon fanatic explorer alcohol trailblazer avid analyst internet geek thinker,7,4,8,6,8,5,1,0
unable type boxing glove total tv maven organizer hipster friendly zombie practitioner,3,6,3,0,8,0,3,0
writer wannabe coffee enthusiast zombie buff evil travel aficionado hardcore student tv advocate internetaholic introvert,6,2,6,1,8,8,9,0
unapologetic webaholic pop culture lover avid creator infuriatingly humble social medium specialist,6,5,2,1,7,3,8,0
internet trailblazer introvert unapologetic student bacon practitioner organizer web evangelist troublemaker pop culture scholar,0,6,7,2,8,2,7,0
avid reader extreme pop culture nerd proud music maven freelance thinker beer fan web aficionado social medium advocate communicator,6,8,6,5,5,8,5,476
evil social medium trailblazer internet fanatic extreme pop culture specialist typical bacon enthusiast,4,6,9,6,2,6,5,0
writer problem solver internet geek web fanatic music evangelist passionate travel lover incurable tv nerd,7,4,5,1,0,8,2,0
certified introvert proud travel junkie avid writer music guru typical tv specialist,7,8,1,5,9,5,8,0
incurable zombie enthusiast food junkie organizer tv guru award winning beeraholic,8,6,0,6,1,9,1,0
problem solver twitter nerd devoted reader general student future teen idol avid analyst internet scholar,0,9,2,8,6,3,3,446
problem solver internet buff tv advocate typical zombie specialist organizer pop culture fan analyst,3,3,2,7,3,8,8,0
amateur communicator lifelong analyst freelance web advocate writer thinker entrepreneur,8,6,3,5,2,2,8,0
writer evil bacon lover social medium fanatic friendly food aficionado explorer,8,4,8,6,4,9,2,0
web advocate introvert tv practitioner analyst thinker devoted alcohol ninja pop culture expert,6,1,1,1,6,4,0,0
coffee trailblazer introvert tv advocate freelance travel geek beer lover passionate social medium fan organizer,3,1,7,3,7,1,0,0
music aficionado web guru coffee fanatic baconaholic tv enthusiast proud twitter nerd,5,1,6,4,0,0,0,0
entrepreneur proud beer guru music fanatic infuriatingly humble pop culture advocate travel maven,3,0,2,7,7,5,4,0
lifelong communicator tv scholar unapologetic analyst web buff pop culture specialist reader,2,7,7,4,5,1,6,0
infuriatingly humble twitter geek amateur problem solver internet scholar explorer,5,0,3,5,7,3,3,0
tv geek beer advocate internet fan food ninja social medium fanatic,3,5,9,3,3,5,3,0
reader zombie expert passionate internet maven problem solver subtly charming beer practitioner incurable bacon enthusiast,2,8,2,5,5,2,5,0
unapologetic organizer introvert twitter geek coffee maven troublemaker pop culture lover,8,0,6,9,6,7,3,0
travel fanatic alcohol geek food enthusiast total bacon specialist writer reader beer scholar explorer thinker,5,3,8,5,6,1,4,0
social medium scholar amateur creator internet nerd lifelong gamer pop culture maven typical coffee geek,9,9,0,1,0,2,8,0
troublemaker travel scholar hardcore tv ninja food fanatic thinker infuriatingly humble bacon aficionado,1,3,2,0,1,4,1,0
tv lover creator introvert web maven freelance twitter evangelist typical internet aficionado,2,3,6,6,6,2,2,0
alcohol fanatic twitter enthusiast coffee geek reader fall lot infuriatingly humble social medium specialist certified gamer,6,9,7,5,5,8,8,0
music aficionado unable type boxing glove gamer zombie fanatic internet practitioner coffee nerd,8,5,2,7,4,9,7,0
zombie aficionado beer maven amateur alcohol expert subtly charming travel geek pop culture ninja internet fan,1,2,4,0,3,6,9,0
entrepreneur social medium guru problem solver coffee nerd friendly music lover,9,5,1,0,8,9,0,0
typical tv nerd beer ninja hardcore travel enthusiast analyst zombie maven writer bacon aficionado social medium fanatic,7,3,6,7,6,9,6,528
introvert zombie fan alcohol practitioner evil beer scholar friendly entrepreneur proud internet advocate creator,5,3,7,9,7,0,1,0
wannabe analyst twitter lover internet trailblazer communicator prone fit apathy organizer evil explorer,1,4,7,7,8,7,1,0
entrepreneur devoted beer advocate bacon geek evil alcohol trailblazer internet junkie,3,3,2,4,6,7,0,0
friendly tv maven alcohol ninja typical web trailblazer music geek pop culture fan avid beer guru,3,9,5,4,0,7,5,0
problem solver general web buff introvert avid pop culture lover hipster friendly zombie junkie alcohol guru twitter ninja,1,3,9,1,7,3,6,0
total beer buff professional travelaholic student explorer wannabe social medium aficionado,1,4,3,4,0,3,1,0
music enthusiast reader zombie nerd extreme analyst communicator wannabe social medium advocate,2,3,8,5,5,4,1,0
introvert entrepreneur reader zombie practitioner alcohol buff communicator twitteraholic,7,6,8,4,1,0,4,0
future teen idol passionate food ninja tv scholar reader web enthusiast internet specialist travel evangelist,1,9,2,6,3,7,3,0
alcohol trailblazer avid web scholar music fanatic typical coffee guru tv aficionado thinker twitter buff zombieaholic,5,0,7,7,5,0,8,0
analyst general tv trailblazer friendly music expert explorer web nerd introvert entrepreneur internet advocate,4,6,8,4,1,8,3,0
zombie fanatic social medium specialist subtly charming beer practitioner entrepreneur bacon maven web junkie,2,3,3,7,7,2,6,0
food expert hipster friendly travel practitioner social medium guru prone fit apathy,9,8,5,2,2,8,7,0
coffee maven fall lot unable type boxing glove alcohol guru gamer,6,2,8,1,1,7,2,0
bacon advocate extreme food practitioner music trailblazer social medium aficionado,7,3,9,5,8,8,1,0
internet fanatic explorer fall lot social medium evangelist travel buff,7,9,5,8,9,7,4,0
writer organizer infuriatingly humble internet fanatic devoted creator gamer music junkie travel enthusiast,2,9,9,9,6,2,9,0
certified music geek student problem solver passionate beer lover freelance zombie nerd pop culture scholar,8,0,0,3,2,2,7,0
zombie evangelist twitter enthusiast web guru evil writer alcohol fan tv geek social medium ninja,8,5,3,8,9,3,8,0
amateur web nerd social medium geek music lover tv fan prone fit apathy,7,6,0,5,2,3,7,0
amateur thinker passionate social medium advocate food fan avid twitter expert evil student,8,0,9,5,6,9,9,0
zombie maven bacon trailblazer food junkie amateur web fanatic lifelong problem solver,5,5,6,4,5,8,5,0
music trailblazer subtly charming food buff general coffee junkie internet maven travel geek,7,0,9,1,6,7,4,0
twitter ninja bacon expert hardcore organizer coffee buff gamer zombie junkie,3,2,6,5,2,8,2,0
tvaholic hardcore travel junkie social medium trailblazer coffee guru gamer proud alcohol fan organizer,8,8,4,4,0,9,9,0
student zombieaholic troublemaker fall lot introvert pop culture expert,0,6,9,0,4,6,0,0
problem solver creator alcohol fan infuriatingly humble zombie geek,3,1,8,4,3,4,5,0
travel maven student hipster friendly beer fanatic typical social medium practitioner explorer alcohol scholar,7,2,4,3,6,8,8,0
coffee advocate hipster friendly communicator food fan music practitioner thinker,9,8,4,6,9,8,6,0
amateur social medium scholar internet aficionado zombie evangelist hipster friendly troublemaker,4,6,4,2,1,4,3,0
amateur student proud internetaholic writer web fan twitter scholar tv junkie hardcore coffee advocate,2,3,0,9,9,0,0,0
troublemaker wannabe bacon advocate proud writer problem solver unapologetic alcohol scholar,7,4,0,3,6,2,0,0
food guru music lover explorer beeraholic wannabe entrepreneur hardcore internet practitioner friend animal everywhere zombie maven,7,5,3,6,8,5,0,228
freelance tv lover extreme troublemaker alcohol aficionado food fanatic gamer friendly creator travel scholar,8,5,8,4,8,3,3,0
student internet advocate social medium aficionado amateur organizer bacon practitioner gamer writer,0,6,1,1,6,5,0,0
hardcore pop culture lover unable type boxing glove wannabe web trailblazer twitter maven,8,5,2,5,0,7,4,0
lifelong social medium geek troublemaker pop culture nerd amateur alcohol fan bacon aficionado tv lover friendly problem solver,6,9,7,5,8,6,3,0
writer zombie fan coffee specialist certified music evangelist passionate thinker organizer,2,9,8,3,4,1,0,0
food enthusiast entrepreneur communicator writer beer advocate alcohol scholar,6,5,0,9,9,5,8,0
pop cultureaholic creator certified twitter junkie incurable problem solver social medium nerd,5,4,7,9,3,0,4,0
twitter maven coffee buff lifelong music aficionado explorer troublemaker thinker,3,4,5,3,0,3,0,0
web buff proud tv fan internet scholar beer ninja food nerd friendly travel junkie evil coffee trailblazer communicator,5,0,8,4,4,9,1,323
creator twitter maven web fanatic reader social medium expert incurable tv practitioner music ninja travel lover,7,2,6,6,6,3,0,0
bacon fanatic beer specialist pop cultureaholic alcohol nerd social medium scholar travel practitioner tv guru,8,0,9,6,6,5,3,0
hardcore troublemaker amateur twitter advocate web practitioner thinker friendly zombie guru,2,9,6,7,1,9,6,0
typical twitter expert food evangelist subtly charming coffee advocate pop culture scholar zombie fan passionate entrepreneur,0,8,7,7,9,1,1,0
general entrepreneur food maven coffee buff web practitioner thinker reader twitter evangelist travel specialist passionate analyst,4,0,6,5,9,4,3,254
introvert subtly charming web nerd problem solver unapologetic twitter enthusiast,1,1,8,6,3,3,6,0
avid food junkie internet fan passionate alcohol geek friendly problem solver award winning social medium lover,1,1,3,3,3,4,3,631
pop cultureaholic travel fanatic music fan analyst food practitioner thinker internet lover,5,1,5,4,4,0,1,0
infuriatingly humble bacon buff twitter expert internetaholic subtly charming communicator entrepreneur explorer evil student tv scholar writer,0,7,8,9,8,8,9,437
avid webaholic wannabe music fan hipster friendly tv lover infuriatingly humble travel geek award winning social medium trailblazer,6,2,6,4,2,1,8,547
zombieaholic alcohol fanatic writer internet aficionado web trailblazer reader thinker,4,8,8,6,0,1,8,0
freelance twitter practitioner analyst passionate alcohol enthusiast zombie aficionado,1,7,3,7,8,7,8,0
proud internet fanatic gamer unapologetic introvert tv expert music enthusiast hipster friendly reader,3,3,4,7,9,2,6,0
alcohol enthusiast reader tv evangelist writer foodaholic proud music advocate explorer introvert internet trailblazer,3,7,9,2,1,4,8,0
twitter enthusiast creator evil coffee practitioner lifelong web evangelist zombie expert,9,5,9,1,2,0,3,0
twitter enthusiast introvert beer nerd baconaholic zombie fanatic entrepreneur unapologetic communicator,7,7,0,0,0,8,7,0
subtly charming bacon enthusiast pop cultureaholic student tv fanatic zombie maven problem solver food lover communicator,4,4,8,2,4,4,5,0
amateur food expert freelance explorer travel advocate alcohol fanatic music scholar professional entrepreneur,4,0,8,3,3,5,7,0
food maven total internet specialist travel trailblazer award winning gamer analyst zombie fanatic coffee geek,0,1,3,3,3,1,5,0
bacon specialist analyst webaholic coffee ninja pop culture aficionado zombie guru tv fanatic,4,3,7,8,4,6,5,0
tv trailblazer student twitter fanatic creator problem solver general coffee scholar,7,2,1,5,2,0,6,0
extreme bacon lover student social medium practitioner internet junkie analyst,2,6,6,6,6,6,6,0
extreme organizer internet nerd bacon evangelist reader lifelong thinker award winning zombie ninja,6,8,8,6,5,3,6,0
