Bios,Movies,TV,Religion,Music,Sports,Books,Politics,Cluster #
beer scholar student twitter expert general coffee evangelist alcohol aficionado hipster friendly reader,8,8,3,3,2,8,0,0
coffeeaholic award winning social medium junkie organizer tv guru zombie aficionado evil thinker devoted gamer introvert,4,5,3,4,3,7,5,0
tv aficionado web expert subtly charming food guru entrepreneur total beer junkie professional student gamer thinker twitter fan,5,8,4,4,2,6,0,371
writer food guru social medium enthusiast unapologetic twitteraholic hardcore music evangelist travel geek student,1,8,1,0,9,9,1,0
lifelong troublemaker twitter ninja unable type boxing glove web guru tv fanatic reader travel geek,3,4,4,7,3,4,4,0
writer award winning travel lover music expert troublemaker,8,9,8,7,8,0,1,0
music expert devoted alcoholaholic introvert social medium buff unable type boxing glove beer fanatic,3,6,3,9,7,0,2,0
certified entrepreneur alcohol practitioner evil zombie enthusiast bacon fanatic food buff,7,6,0,5,9,7,6,0
devoted music practitioner bacon fanatic total food evangelist web nerd reader passionate organizer award winning internet enthusiast,8,9,2,1,0,9,0,282
friendly internet expert student organizer infuriatingly humble thinker web lover beer junkie,6,7,5,8,8,4,8,0
writer bacon maven reader communicator thinker introvert food junkie problem solver,6,1,8,9,0,7,0,0
tv fan prone fit apathy proud writer troublemaker award winning internet evangelist,2,1,1,0,9,7,2,0
organizer explorer unapologetic coffee guru internet trailblazer wannabe alcohol advocate extreme music specialist,6,9,9,6,6,1,5,0
tv ninja entrepreneur alcohol guru social medium aficionado twitter practitioner organizer,4,9,7,0,8,2,6,0
incurable food advocate student thinker friend animal everywhere friendly communicator creator,0,9,5,0,6,1,5,0
extreme bacon practitioner introvert student explorer hardcore internet aficionado beeraholic gamer zombie advocate communicator tv geek writer,6,6,3,2,4,9,6,200
amateur social medium expert coffee specialist beer advocate internet geek,7,4,4,0,4,7,2,0
professional travel advocate evil internet guru freelance coffee trailblazer bacon evangelist,6,2,1,4,3,0,7,0
hardcore social medium evangelist award winning entrepreneur typical analyst infuriatingly humble explorer,7,3,2,1,1,0,6,0
professional social medium fan writer award winning pop culture maven avid twitter specialist amateur web fanatic,5,9,1,2,9,4,4,496
friendly travel lover bacon expert hardcore coffee nerd alcohol fan web specialist,2,2,4,1,5,9,3,0
bacon enthusiast web fanatic internet geek music expert hipster friendly writer hardcore social medium ninja,6,9,9,4,1,9,1,0
bacon guru award winning travel expert social medium fanatic internet nerd total tv scholar,5,1,3,8,3,0,7,0
troublemaker hardcore entrepreneur thinker web specialist social medium ninja zombie fanatic,6,9,6,7,8,0,0,0
gamer alcohol ninja student web nerd friend animal everywhere pop culture fanatic,2,9,9,8,5,6,1,0
avid music fan coffee practitioner social medium nerd food buff,8,4,3,3,5,7,2,0
internet junkie twitter ninja web trailblazer beer evangelist reader travel advocate,9,8,2,5,5,5,7,0
internet enthusiast extreme travel trailblazer troublemaker organizer student,6,7,7,0,9,7,0,0
professional internet practitioner coffee enthusiast explorer food trailblazer,0,1,6,6,2,4,2,0
unapologetic coffee junkie internet advocate communicator organizer troublemaker,9,0,8,6,8,1,7,0
travel junkie music aficionado internet scholar award winning troublemaker hipster friendly social medium fan,7,2,9,2,0,6,9,0
pop culture expert proud beer enthusiast typical social medium scholar amateur tv fanatic music nerd food ninja internet guru total creator,6,4,7,3,2,9,0,485
tv guru bacon fanatic music lover fall lot certified twitter evangelist social medium specialist reader,3,4,9,8,1,3,5,0
web ninja freelance tv trailblazer professional bacon junkie coffee buff pop culture specialist,7,1,3,3,2,7,8,0
social medium enthusiast internet geek zombie maven twitter nerd bacon buff student,8,1,2,9,7,1,2,0
certified tv ninja avid alcohol geek freelance bacon fanatic internet enthusiast,7,2,6,6,3,1,0,0
prone fit apathy avid bacon expert music guru pop cultureaholic beer junkie food ninja,8,8,2,6,2,5,8,134
foodaholic travel guru explorer coffee scholar award winning web practitioner music geek passionate analyst,3,3,3,4,3,0,1,0
music scholar beer fanatic fall lot entrepreneur twitter advocate problem solver,5,1,3,9,0,7,2,0
lifelong explorer professional analyst entrepreneur web trailblazer pop culture guru extreme coffee enthusiast,7,3,3,3,4,7,9,0
bacon lover friendly internet scholar thinker tv fanatic wannabe explorer social medium specialist food nerd,1,9,6,1,5,7,2,0
lifelong food fanatic beer ninja tv advocate social medium junkie wannabe alcohol expert,2,4,0,3,0,9,3,0
alcohol trailblazer travel expert friendly thinker reader pop culture junkie internet maven food scholar bacon aficionado web geek,3,0,5,6,5,6,6,106
tv fanatic proud bacon aficionado pop culture nerd evil webaholic internet buff amateur travel enthusiast,0,9,6,8,7,7,7,0
troublemaker organizer tv nerd subtly charming travel advocate food ninja internetaholic coffee evangelist zombie fan,4,6,5,7,2,7,4,0
creator twitter specialist freelance reader passionate webaholic hardcore coffee guru lifelong music aficionado,4,6,4,3,5,4,9,0
problem solver general tv ninja web fanatic friendly troublemaker zombie practitioner,3,5,6,4,6,6,9,0
tv buff social medium aficionado twitter fan pop culture fanatic unapologetic troublemaker avid music advocate,2,0,2,1,9,6,9,0
amateur food ninja devoted web enthusiast internetaholic hipster friendly communicator freelance creator professional beer evangelist,7,1,2,4,5,9,3,444
hardcore tv buff creator problem solver travel aficionado internet geek friend animal everywhere pop culture fanatic,2,7,3,3,8,6,5,0
twitter specialist gamer avid travel advocate communicator web guru entrepreneur creator,2,5,2,8,5,3,4,0
entrepreneur tv nerd troublemaker internet trailblazer hardcore thinker twitter buff writer,8,7,6,5,4,3,8,0
web junkie social medium nerd internet ninja beeraholic organizer extreme gamer thinker,4,7,8,4,7,9,8,0
coffeeaholic communicator devoted thinker travel fan introvert bacon fanatic writer internet evangelist,1,3,6,6,9,4,0,0
lifelong music enthusiast internet junkie wannabe food advocate social medium maven student,2,0,4,3,4,3,6,0
subtly charming travel enthusiast tv maven internet junkie creator prone fit apathy social medium advocate alcohol fanatic,5,3,6,8,0,3,2,0
thinker devoted webaholic hipster friendly introvert pop culture junkie analyst communicator,5,1,4,6,5,8,4,0
food advocate troublemaker zombie aficionado pop culture specialist organizer student,2,5,7,9,1,5,9,0
friendly web junkie amateur explorer twitteraholic food buff total gamer thinker analyst,8,3,6,2,8,3,8,0
gamer hipster friendly explorer twitter evangelist music practitioner troublemaker reader freelance thinker,7,3,4,2,2,6,7,0
wannabe entrepreneur beer fanatic web nerd music specialist analyst gamer creator writer,7,2,4,2,4,4,4,0
music maven social medium trailblazer devoted zombie buff friendly travel guru organizer,7,1,5,0,9,5,6,0
incurable reader tv practitioner proud food geek typical student writer,0,7,6,4,1,6,4,0
reader bacon practitioner creator zombie maven total gamer web scholar future teen idol coffee aficionado travel enthusiast,1,5,4,9,7,8,2,222
analyst zombie aficionado coffee geek twitter evangelist tv enthusiast introvert,0,9,2,3,4,4,3,0
beer trailblazer alcohol geek friendly student problem solver entrepreneur bacon enthusiast food nerd,2,4,6,1,0,1,6,0
total entrepreneur music nerd problem solver travel advocate web expert zombie guru writer,8,9,5,5,5,9,6,0
alcohol maven total twitter fanatic travel guru tv aficionado introvert,9,7,6,7,2,4,9,0
infuriatingly humble bacon buff unable type boxing glove travelaholic zombie fanatic,8,6,8,4,0,0,1,0
bacon ninja subtly charming food guru twitter expert problem solver travel trailblazer friendly zombie lover,9,4,2,3,1,5,0,0
organizer coffee junkie analyst unapologetic introvert bacon specialist student social medium advocate,3,3,4,0,0,6,7,0
passionate introvert tv guru incurable alcohol fan web geek beer expert,6,6,5,2,4,3,8,0
music specialist subtly charming entrepreneur web advocate total reader friendly twitter junkie coffee fanatic general alcohol maven,4,1,8,7,7,1,3,221
organizer amateur alcohol advocate future teen idol travel fanatic student subtly charming coffee lover twitter enthusiast,3,5,7,9,6,5,7,0
social medium junkie alcohol aficionado coffee buff tv expert reader food ninja gamer beer scholar extreme bacon geek,3,1,0,1,4,9,3,548
travelaholic internet specialist analyst infuriatingly humble organizer alcohol maven,6,0,7,6,8,7,2,0
hardcore analyst food evangelist award winning travel enthusiast music junkie communicator,5,1,9,9,1,5,7,0
zombie practitioner pop culture aficionado internet enthusiast web lover gamer student unapologetic writer,8,8,2,1,4,0,4,0
future teen idol proud twitter fanatic evil travelaholic internet trailblazer web guru bacon specialist zombie maven,1,0,8,7,8,8,8,231
entrepreneur devoted introvert unable type boxing glove beer practitioner,7,3,1,9,4,1,8,0
analyst evil web evangelist music fanatic thinker travel fan tv practitioner,4,6,3,9,8,2,3,0
award winning tv scholar troublemaker incurable writer zombie nerd thinker alcohol expert devoted web geek,9,0,6,5,6,1,7,395
entrepreneur subtly charming communicator gamer wannabe student travel specialist,2,3,7,4,1,0,0,0
analyst internet fan extreme web buff reader music nerd pop culture geek award winning gamer,2,7,4,9,6,7,5,0
incurable travel buff proud music fanatic friendly web lover twitter specialist zombie fan social medium geek,3,6,7,0,5,6,6,0
entrepreneur music ninja hardcore alcohol junkie unapologetic organizer analyst web buff,9,1,4,8,4,9,3,0
explorer web aficionado reader tv lover hipster friendly problem solver music nerd troublemaker travel fanatic,8,7,9,1,5,0,4,481
introvert tv expert internet practitioner entrepreneur lifelong bacon enthusiast twitter maven,5,4,4,7,4,7,5,0
beer maven organizer social medium advocate student reader avid web trailblazer,5,5,5,0,5,8,6,0
communicator reader certified beer fanatic alcohol geek hipster friendly zombie guru gamer,6,6,9,6,6,4,8,0
subtly charming analyst internet scholar professional entrepreneur tv practitioner,6,3,5,4,0,0,4,0
music guru travel fanatic food junkie introvert web enthusiast troublemaker total thinker coffee buff tv nerd,8,3,3,2,0,9,9,0
alcohol nerd subtly charming web enthusiast hipster friendly student internet scholar total music lover writer,7,3,5,1,2,9,4,0
extreme tv buff proud introvert professional internet geek travel specialist coffee nerd,4,5,8,7,2,5,3,0
avid analyst passionate explorer freelance writer tv trailblazer coffee geek web evangelist student,4,2,2,0,5,4,2,0
web junkie twitter guru award winning tv evangelist unapologetic problem solver,3,2,6,7,4,2,0,0
typical zombie practitioner extreme social mediaholic bacon evangelist evil web junkie,3,7,3,8,5,4,8,0
problem solver passionate tv nerd analyst pop culture geek proud coffee fan alcohol aficionado zombie expert,1,3,8,8,4,4,1,0
incurable reader pop culture trailblazer zombie lover thinker extreme alcohol practitioner,8,0,9,6,2,9,8,0
general twitter trailblazer bacon evangelist explorer travel practitioner avid student writer tv fanatic future teen idol organizer,5,1,6,9,9,4,6,310
devoted internet scholar social medium evangelist web fanatic entrepreneur music geek,7,0,7,6,0,0,6,0
web fan typical introvert twitter lover writer professional entrepreneur coffee aficionado,7,7,0,9,7,7,5,0
pop culture fanatic beeraholic award winning student organizer bacon enthusiast social medium lover tv advocate alcohol geek gamer,3,0,3,4,8,9,3,0
zombie ninja evil pop culture lover hipster friendly alcohol advocate beer nerd reader,7,8,4,3,8,5,8,0
hardcore communicator friendly pop culture maven future teen idol music evangelist beer fanatic,2,8,9,7,0,3,1,0
twitter fan problem solver wannabe analyst tv aficionado thinker extreme explorer travel geek,0,2,4,7,5,8,0,0
pop culture fan travel nerd amateur communicator general writer friendly music geek,2,2,6,8,5,2,4,0
beer scholar bacon enthusiast thinker certified creator problem solver food specialist total travel junkie coffee geek,6,8,1,9,5,4,6,421
web enthusiast food trailblazer coffee fan thinker analyst bacon expert student total writer,3,5,3,1,5,5,0,0
internet buff explorer student introvert music lover thinker organizer gamer certified analyst,3,1,5,6,4,8,7,0
devoted social medium buff problem solver incurable creator alcohol fanatic web practitioner,3,8,7,0,1,9,6,0
beer fanatic passionate gamer social medium specialist foodaholic web lover typical tv trailblazer,8,2,7,6,5,2,9,0
coffee evangelist social medium enthusiast fall lot zombie fanatic typical music expert,5,3,6,4,0,7,8,0
award winning alcohol scholar travel fanatic hardcore pop cultureaholic professional zombie ninja,9,6,0,5,6,2,8,0
social medium enthusiast bacon nerd music evangelist gamer tv geek hardcore zombie specialist,0,3,0,5,8,2,8,0
entrepreneur tvaholic reader twitter evangelist friend animal everywhere,5,9,1,4,9,1,4,0
fall lot thinker introvert extreme social medium buff pop culture junkie,4,8,5,2,5,5,4,0
wannabe twitter ninja music specialist beer nerd evil explorer infuriatingly humble introvert freelance zombie maven subtly charming communicator,6,7,5,9,1,8,9,218
web aficionado award winning communicator troublemaker alcohol ninja food trailblazer,2,3,9,3,3,1,7,0
twitter geek fall lot extreme pop culture maven hardcore bacon enthusiast,3,8,7,0,3,6,9,0
pop culture fan unapologetic alcohol practitioner analyst subtly charming web trailblazer typical tv evangelist,6,0,3,5,0,7,5,0
lifelong creator bacon practitioner beer evangelist internet fanatic coffee expert tv junkie,1,2,1,0,1,0,7,0
friendly web practitioner coffee trailblazer internet junkie tv lover pop culture fanatic,1,5,3,1,9,4,9,0
troublemaker subtly charming social medium nerd zombie expert communicator hardcore coffee advocate web maven twitter scholar gamer,9,5,9,1,0,5,3,0
student zombie evangelist passionate coffee expert communicator twitter aficionado web specialist,0,4,3,3,8,7,3,0
future teen idol internet ninja bacon fan music fanatic incurable twitter enthusiast amateur alcohol aficionado web practitioner,2,8,0,8,3,3,1,163
social medium nerd writer internet junkie travel guru freelance bacon specialist,5,0,9,5,7,2,0,0
student web specialist food junkie devoted coffee fan communicator subtly charming travel nerd pop culture scholar,0,0,1,2,7,5,4,0
web advocate extreme twitter nerd zombie lover pop culture ninja baconaholic coffee guru food buff,5,4,9,4,7,9,7,0
bacon scholar alcohol maven pop culture geek zombieaholic coffee nerd,4,1,0,4,1,4,8,0
web fanatic beer ninja pop culture fan devoted tv aficionado total food advocate,7,5,5,6,0,6,2,0
total zombieaholic wannabe travel guru lifelong social medium nerd organizer incurable writer,5,6,6,5,7,7,9,0
social medium geek amateur coffee specialist freelance pop culture trailblazer devoted gamer thinker twitter advocate travel guru,3,8,0,0,8,7,6,0
lifelong tv guru amateur problem solver zombie buff gamer internet fan social medium scholar certified thinker,5,8,8,1,6,0,6,582
evil twitter fanatic total explorer zombie enthusiast food buff alcohol expert,1,2,6,8,8,2,7,0
general student explorer bacon scholar incurable writer wannabe introvert problem solver,3,7,6,0,1,3,3,0
pop culture ninja troublemaker problem solver friendly organizer internet specialist entrepreneur amateur thinker travel enthusiast,8,9,4,5,4,0,8,0
typical pop culture maven incurable web junkie professional coffee nerd total tv aficionado alcohol ninja,0,0,6,2,1,7,9,0
pop culture trailblazer bacon ninja subtly charming food aficionado alcohol fanatic internet guru passionate tv junkie,2,6,4,0,4,9,8,0
amateur zombie fanatic thinker food evangelist twitter guru tv advocate coffee junkie general pop culture trailblazer,8,1,8,3,5,6,5,0
beer maven evil social medium specialist coffee buff passionate writer general internet advocate tv guru,1,3,7,6,3,0,3,0
professional social medium junkie subtly charming troublemaker freelance food advocate friendly tv nerd analyst,0,5,2,4,3,3,6,0
freelance zombie maven organizer certified reader beer junkie evil music evangelist thinker problem solver,2,2,9,7,6,9,6,0
music trailblazer lifelong entrepreneur student gamer explorer passionate analyst,0,4,9,0,3,8,6,0
entrepreneur pop culture aficionado friendly troublemaker certified internet fanatic subtly charming analyst,3,6,1,4,2,1,3,0
thinker zombie advocate evil beer fanatic incurable organizer twitteraholic alcohol geek,5,9,2,5,7,2,0,0
passionate music specialist amateur organizer alcohol geek web enthusiast food ninja twitter lover professional bacon advocate,2,3,1,6,3,9,4,240
coffee fan troublemaker prone fit apathy devoted gamer food geek bacon expert web buff,0,9,1,2,3,5,4,0
evil explorer music geek hipster friendly twitter ninja tv trailblazer creator food specialist travel scholar,0,3,9,5,4,4,2,451
infuriatingly humble reader wannabe coffeeaholic social medium nerd tv scholar,0,7,3,7,1,6,7,0
pop culture fan problem solver reader bacon lover hipster friendly web specialist communicator proud travelaholic,9,9,3,2,9,7,5,0
pop culture fan problem solver thinker introvert hardcore internet advocate devoted alcohol buff,9,2,1,6,5,5,2,0
total communicator problem solver bacon scholar writer thinker student typical explorer analyst,4,0,8,1,8,1,5,0
twitter fanatic organizer social mediaholic explorer general bacon evangelist tv advocate,4,6,1,4,8,4,8,0
hardcore music fanatic travel practitioner pop culture junkie food nerd writer proud social medium specialist typical twitter geek,6,6,4,0,5,7,5,0
communicator pop culture aficionado reader web geek organizer beer fan,8,5,0,5,0,4,4,0
typical zombie trailblazer student lifelong internet lover social medium advocate,9,2,2,3,3,3,7,0
alcohol enthusiast evil problem solver bacon scholar zombie fanatic twitter ninja proud gamer,5,5,3,8,0,6,4,0
writer zombie trailblazer web expert tv enthusiast unapologetic bacon ninja pop culture buff,3,4,2,0,3,2,4,0
total pop culture buff typical creator coffee lover food aficionado award winning writer tv fanatic gamer certified zombie specialist reader,1,3,3,9,8,9,0,27
coffee fan beer buff musicaholic typical travel evangelist creator alcohol geek bacon fanatic,7,2,1,3,3,4,6,0
web trailblazer zombie expert twitter nerd amateur social medium junkie certified food buff hardcore organizer avid bacon scholar,1,2,8,8,2,2,1,630
social medium fanatic beer scholar friendly communicator unable type boxing glove bacon buff,7,1,4,4,5,6,4,0
amateur twitter trailblazer passionate entrepreneur music advocate internet scholar analyst,5,6,9,6,4,9,6,0
social medium fanatic thinker zombie enthusiast bacon evangelist freelance communicator wannabe internetaholic total tv trailblazer,1,5,9,7,4,7,4,0
twitter nerd wannabe entrepreneur zombie junkie music ninja tv lover student,1,9,9,8,2,1,7,0
problem solver travel specialist zombie fanatic beer nerd pop culture scholar,6,5,6,7,4,5,6,0
professional entrepreneur zombie fan unapologetic travel scholar amateur writer analyst,6,4,3,0,3,3,8,0
travel trailblazer total analyst award winning social medium fan music fanatic writer,6,4,9,0,7,4,5,0
lifelong communicator social medium geek foodaholic troublemaker wannabe writer web enthusiast introvert twitter lover,7,1,3,8,2,6,6,0
lifelong food aficionado reader fall lot bacon guru pop culture nerd,3,1,3,3,7,8,0,0
food specialist pop culture nerd alcohol aficionado internet expert professional coffee scholar avid tv enthusiast,0,5,4,3,0,9,1,0
general alcohol trailblazer problem solver avid food practitioner pop culture guru incurable tv scholar coffee nerd zombie lover,0,5,7,8,2,4,2,45
organizer creator travel maven reader twitter fanatic food aficionado incurable gamer,4,7,6,4,5,5,3,0
internet practitioner prone fit apathy friendly food enthusiast extreme web expert,6,3,2,2,8,7,3,0
problem solver wannabe analyst typical writer freelance internet geek music guru subtly charming tv buff,6,9,5,1,9,2,9,0
typical pop culture nerd reader beer maven devoted music fanatic coffee ninja entrepreneur bacon advocate creator extreme food fan,4,0,5,1,3,5,2,6
wannabe food lover beeraholic twitter maven certified reader avid thinker alcohol advocate,4,2,3,1,5,8,9,0
social medium guru freelance web buff tv geek coffee fan twitter fanatic alcohol advocate proud travel scholar,0,2,7,8,0,0,1,0
food geek future teen idol gamer explorer certified alcohol fan music trailblazer pop culture aficionado,8,0,1,7,4,1,3,0
evil music maven creator subtly charming communicator certified bacon ninja,8,0,7,9,8,7,8,0
bacon buff passionate alcohol practitioner introvert problem solver,0,3,4,6,9,2,6,0
troublemaker thinker student twitter fanatic music evangelist gamer problem solver beer geek friendly organizer,6,0,3,0,6,9,9,0
prone fit apathy hardcore reader zombie geek friendly problem solver creator bacon fan analyst freelance beer advocate,9,8,5,5,7,3,0,347
unapologetic coffee lover wannabe pop culture specialist social medium advocate thinker alcohol buff,3,7,3,0,6,2,8,0
tv fanatic internet advocate analyst food guru music trailblazer writer incurable bacon specialist,8,6,6,1,5,0,9,0
beer buff tv junkie music fan student internet geek writer zombie trailblazer,8,7,2,7,6,4,2,0
award winning tv guru thinker beer enthusiast twitter junkie coffee ninja food evangelist subtly charming troublemaker zombieaholic,0,6,3,4,1,0,1,305
introvert alcohol enthusiast evil social medium fan food geek entrepreneur travel aficionado,7,3,5,6,9,8,1,0
twitter specialist evil social medium buff reader future teen idol infuriatingly humble problem solver,1,1,5,4,0,8,6,0
alcohol junkie certified twitter nerd analyst communicator extreme pop culture advocate food guru travelaholic,6,8,5,9,1,2,7,0
zombie fanatic bacon practitioner tv lover thinker travel expert organizer web evangelist reader,5,0,2,1,9,5,7,0
tv ninja thinker twitter buff gamer entrepreneur music fanatic bacon scholar pop cultureaholic social medium guru writer student,8,1,9,0,3,4,5,515
coffee practitioner food evangelist future teen idol web specialist alcohol fan,5,0,3,5,4,8,8,0
twitter specialist passionate alcohol advocate future teen idol tv expert explorer,3,6,1,8,5,3,0,0
pop culture enthusiast writer infuriatingly humble entrepreneur wannabe webaholic,4,7,5,9,4,1,3,0
entrepreneur internet lover organizer tv aficionado web expert pop cultureaholic,6,4,2,1,1,1,2,0
explorer evil thinker certified writer social medium nerd food maven baconaholic travel expert,4,5,2,7,6,1,5,0
hardcore student typical zombie evangelist alcohol fan subtly charming music enthusiast communicator coffee junkie,2,3,0,7,8,8,2,172
tv enthusiast web advocate pop culture ninja analyst infuriatingly humble food junkie,0,0,7,5,5,9,3,0
introvert evil student bacon geek pop culture scholar writer freelance entrepreneur,0,2,8,0,7,8,1,0
coffee guru creator friendly internet advocate general bacon ninja devoted tv expert problem solver troublemaker,5,6,5,8,6,9,6,0
incurable reader entrepreneur wannabe writer coffee buff communicator,1,4,6,1,3,3,3,0
typical analyst social medium scholar organizer certified travel junkie alcohol expert pop culture specialist,6,8,0,3,2,1,6,0
twitter geek general bacon enthusiast coffee fanatic food fan organizer web ninja creator extreme alcohol trailblazer,2,5,3,3,7,0,0,0
beeraholic subtly charming explorer friendly student introvert certified tv expert,3,1,8,6,3,8,2,0
evil pop culture lover lifelong creator student general coffee expert wannabe beer maven,8,5,3,0,3,1,7,0
wannabe beeraholic amateur zombie trailblazer proud social medium practitioner twitter aficionado internet fan,6,5,9,6,4,5,9,0
devoted music nerd evil food maven total coffee junkie award winning bacon buff internet evangelist,6,0,4,7,1,0,7,242
infuriatingly humble beer fan total zombie enthusiast music buff pop cultureaholic general troublemaker,8,2,9,0,6,1,6,0
web ninja tv lover troublemaker award winning reader zombie aficionado,9,0,6,0,4,0,1,0
zombie advocate internet fanatic general coffee expert typical bacon ninja web lover,1,1,2,6,5,9,2,0
professional gamer writer coffee junkie wannabe pop culture guru friend animal everywhere,9,6,4,3,3,2,8,0
alcohol advocate problem solver certified student pop culture enthusiast,2,3,5,3,1,3,5,0
tv advocate music specialist pop culture aficionado bacon enthusiast introvert analyst coffee guru amateur gamer passionate reader,1,7,0,3,7,1,2,62
lifelong travel guru webaholic tv nerd internet junkie pop culture expert communicator,9,5,0,6,2,3,4,0
lifelong writer passionate tv fan explorer proud social medium aficionado award winning coffee evangelist,5,7,9,4,3,1,2,568
bacon nerd music scholar tv fanatic friendly gamer social medium geek writer web advocate,9,7,8,5,3,5,5,0
future teen idol typical creator tv enthusiast hardcore music advocate zombie aficionado pop culture buff,6,6,4,1,0,3,3,0
analyst bacon scholar music nerd social medium specialist tvaholic proud twitter junkie reader communicator food expert freelance travel practitioner,8,5,7,6,8,9,5,638
award winning bacon expert food practitioner problem solver web junkie alcohol fanatic,0,3,7,4,0,5,9,0
social medium geek freelance gamer subtly charming tv evangelist travelaholic total beer junkie,9,5,7,0,9,4,6,0
social medium advocate thinker introvert pop culture fan lifelong organizer zombie expert entrepreneur creator proud gamer reader web guru,0,9,6,3,2,2,0,469
food ninja communicator alcohol fanatic coffee maven proud music lover travel aficionado tv evangelist,9,1,8,4,3,7,5,0
internet specialist pop culture geek tv advocate award winning entrepreneur introvert,5,5,5,6,9,1,3,0
