Bios,Movies,TV,Religion,Music,Sports,Books,Politics,Cluster #
devoted thinker pop culture practitioner future teen idol typical alcohol fanatic web guru beer evangelist,3,5,7,0,4,7,3,0
analyst evil writer twitter advocate proud explorer friendly alcohol ninja,3,5,5,2,4,8,2,0
general music advocate avid pop culture aficionado zombie trailblazer tv ninja,2,3,7,3,9,8,5,0
music trailblazer web evangelist gamer reader thinker twitteraholic creator,8,3,1,7,3,3,6,0
gamer food maven twitter specialist alcohol scholar internet ninja total tv practitioner zombie advocate creator reader,8,6,4,4,3,3,7,148
incurable web buff passionate beer practitioner avid creator analyst entrepreneur gamer,2,3,7,8,2,1,6,0
passionate twitter lover friendly introvert infuriatingly humble thinker evil travel fanatic proud creator coffee aficionado analyst,6,7,0,7,2,0,5,296
organizer entrepreneur coffee aficionado explorer travel lover incurable creator,8,6,0,2,0,1,2,0
evil reader web fan writer devoted analyst typical coffee buff food scholar friendly troublemaker,2,3,0,4,4,0,7,0
fall lot tv advocate bacon evangelist coffee fanatic troublemaker general thinker,5,0,0,3,1,9,1,0
freelance writer thinker web fanatic reader communicator entrepreneur,5,4,1,5,5,2,1,0
alcohol buff wannabe internet maven social medium aficionado infuriatingly humble food ninja typical pop culture trailblazer,9,6,2,6,4,7,4,0
general food junkie pop culture scholar evil zombie evangelist extreme alcohol enthusiast,5,0,2,4,0,0,8,0
evil alcohol guru twitter maven travel expert passionate food specialist entrepreneur beer ninja coffee junkie,4,8,4,8,7,8,5,0
web maven baconaholic writer wannabe creator social medium scholar introvert proud reader,8,7,1,1,2,3,6,0
coffeeaholic internet expert student social medium advocate pop culture guru zombie evangelist thinker,3,4,3,0,1,1,2,0
award winning introvert prone fit apathy organizer entrepreneur freelance zombie aficionado analyst web fanatic,6,8,1,0,2,9,7,317
travel fanatic writer pop culture buff coffee junkie infuriatingly humble beer expert,1,2,5,2,6,7,6,0
food aficionado general tv scholar bacon advocate student friendly social medium expert,6,5,3,9,3,6,4,0
travel enthusiast web lover tv specialist music aficionado pop culture maven evil zombie nerd,3,3,8,6,9,5,4,0
zombieaholic friend animal everywhere web fan food junkie student coffee buff social medium guru,5,8,8,4,9,8,1,0
evil coffeeaholic award winning music fan twitter specialist zombie buff devoted food practitioner,8,1,7,3,5,5,5,0
web lover creator coffee fanatic travel geek food nerd internet maven avid bacon ninja,5,1,9,8,8,3,1,0
avid bacon evangelist pop culture scholar introvert music nerd web fan analyst,7,1,0,3,3,4,4,0
beer buff music advocate unapologetic introvert twitter evangelist alcohol trailblazer entrepreneur tv ninja travel nerd,9,2,4,7,6,1,6,0
introvert food maven avid bacon nerd lifelong writer typical beer fanatic analyst,0,3,3,6,3,1,7,0
hardcore beer geek bacon maven introvert internet advocate food practitioner freelance organizer,5,0,0,3,5,7,0,0
zombie fanatic alcohol advocate friendly twitter specialist beer scholar tv geek,5,8,8,6,7,5,3,0
professional beeraholic bacon junkie lifelong organizer food specialist music geek extreme gamer web guru,2,8,8,9,2,2,0,0
alcohol advocate student passionate analyst lifelong twitter expert zombie aficionado writer,2,2,5,4,7,6,0,0
twitter practitioner avid travel geek pop culture evangelist tv fanatic total coffee lover,6,4,8,5,3,9,4,0
award winning web fan extreme coffee aficionado music buff alcohol ninja typical tv maven,4,6,2,8,5,6,1,0
devoted bacon geek problem solver beer fanatic travel advocate coffee guru zombie lover internet evangelist,0,6,3,3,2,3,4,0
travel aficionado freelance internet practitioner hipster friendly bacon enthusiast problem solver passionate twitter specialist,6,2,6,4,0,3,5,0
food guru problem solver incurable twitter nerd writer alcohol advocate social medium practitioner beer enthusiast future teen idol creator,9,5,0,1,3,6,2,559
web aficionado troublemaker social medium advocate alcohol practitioner organizer,9,1,3,4,5,2,8,0
web expert writer typical alcohol practitioner certified troublemaker internet scholar creator zombie aficionado,9,9,3,6,3,2,5,0
web specialist zombie trailblazer general internet geek amateur music nerd wannabe student,1,1,9,4,4,4,5,0
zombie evangelist gamer hipster friendly alcohol trailblazer twitter guru evil thinker travel expert beer maven music enthusiast,9,4,3,3,7,4,1,0
friendly tvaholic zombie guru web advocate internet fan subtly charming reader avid alcohol nerd beer maven,4,5,2,3,5,0,9,167
problem solver food fanatic incurable creator reader social medium maven bacon junkie entrepreneur twitteraholic,4,0,6,5,7,5,8,0
music junkie analyst beer advocate troublemaker pop culture practitioner thinker internet aficionado incurable writer entrepreneur,0,2,1,7,8,0,6,0
student tv scholar unapologetic bacon evangelist gamer analyst beer enthusiast social medium specialist,0,5,8,5,1,0,1,0
general thinker beer lover food evangelist social medium maven travel expert web advocate,6,0,0,3,9,9,5,0
introvert prone fit apathy bacon fanatic student twitter maven beer buff tv enthusiast,7,6,7,6,5,0,3,0
organizer internet aficionado future teen idol friendly bacon fan pop culture practitioner,3,8,5,8,1,5,8,0
friendly twitter lover incurable communicator student tv scholar alcohol nerd general thinker zombie maven,4,2,3,8,3,6,5,0
incurable beer advocate twitter enthusiast coffeeaholic student typical troublemaker web lover,4,6,7,2,4,0,6,0
twitter nerd webaholic freelance pop culture aficionado organizer social medium geek reader,2,9,5,1,8,2,1,0
twitter trailblazer travel fanatic coffee ninja bacon guru hardcore introvert communicator internet practitioner,2,7,6,2,5,0,4,0
reader general tv fanatic beer practitioner thinker wannabe alcohol expert communicator zombie enthusiast coffee specialist,8,7,3,9,7,5,8,0
freelance reader music aficionado alcohol enthusiast bacon fanatic social medium buff unapologetic beer evangelist,5,4,1,4,9,9,6,0
coffee geek extreme travel trailblazer unapologetic twitter nerd musicaholic tv aficionado,2,7,8,1,3,6,9,0
problem solver amateur web expert professional communicator thinker hardcore twitter lover troublemaker,2,2,7,1,4,3,0,0
food practitioner award winning tv nerd reader music expert total social medium fanatic gamer twitter buff,8,3,9,9,7,5,3,598
wannabe twitter fanatic tv nerd beer ninja food specialist music trailblazer subtly charming coffee practitioner,6,3,5,4,7,4,3,0
hipster friendly social medium guru travel lover infuriatingly humble zombie junkie bacon fan tv geek writer,0,6,0,3,7,7,4,547
beeraholic zombie expert devoted introvert social medium ninja tv practitioner bacon maven,5,5,8,9,1,2,2,0
travel specialist unapologetic explorer internet fanatic bacon practitioner total zombie junkie,8,9,8,0,0,8,4,0
zombie buff writer freelance thinker passionate coffee guru entrepreneur internet enthusiast,6,6,8,7,1,4,0,0
gamer professional social medium expert zombie scholar coffee lover beer practitioner pop culture junkie bacon ninja communicator,8,4,3,6,3,1,8,0
beer fanatic introvert bacon geek incurable explorer lifelong zombie fan,5,7,2,5,9,9,0,0
tv guru music scholar avid troublemaker infuriatingly humble web fanatic travel enthusiast,2,7,7,2,3,7,8,0
food ninja extreme gamer hardcore explorer fall lot alcohol evangelist beer scholar,0,9,1,4,0,8,1,0
fall lot wannabe zombie practitioner twitter ninja introvert writer alcohol trailblazer,3,1,7,1,3,3,8,0
lifelong gamer incurable bacon geek food expert wannabe music trailblazer infuriatingly humble travel maven,8,1,0,5,0,7,0,337
devoted web scholar travel fanatic writer typical music advocate award winning internetaholic social medium expert,1,2,4,7,2,5,2,0
web maven writer entrepreneur extreme communicator incurable analyst reader friend animal everywhere travel ninja,4,8,7,4,1,4,9,0
music scholar explorer coffee aficionado troublemaker student analyst zombie ninja entrepreneur communicator,5,8,3,8,1,6,3,0
coffee fanatic proud gamer tv practitioner communicator pop culture expert bacon evangelist alcohol ninja,6,4,0,6,6,4,4,0
web expert explorer introvert gamer creator freelance tvaholic twitter junkie alcohol nerd award winning social medium enthusiast,9,2,7,5,5,6,7,655
devoted web fanatic student evil music junkie wannabe twitter maven writer avid tv aficionado,4,7,3,4,3,4,2,0
coffee specialist incurable travelaholic troublemaker writer unapologetic bacon maven alcohol advocate,4,2,6,2,7,7,9,0
incurable pop culture lover tv enthusiast social medium ninja gamer freelance music buff,7,2,2,1,7,3,3,0
food enthusiast social medium evangelist total alcohol scholar internet buff web advocate,7,6,2,8,8,1,9,0
typical web fan beer expert introvert professional zombie enthusiast general tv ninja coffee trailblazer internet guru,2,4,1,7,9,2,7,0
pop culture scholar incurable tv geek twitter fanatic internet enthusiast travel fan,6,3,5,2,9,0,1,0
future teen idol beer specialist thinker incurable alcohol fanatic,2,1,8,3,2,4,7,0
hipster friendly social medium buff food expert organizer passionate writer student,1,5,6,6,3,3,4,0
tv aficionado hipster friendly problem solver passionate reader food guru coffee specialist,0,4,0,1,7,0,6,0
alcohol junkie general tv aficionado hipster friendly music lover coffee evangelist explorer baconaholic infuriatingly humble pop culture fanatic,5,0,6,8,5,6,5,0
pop culture maven lifelong travel enthusiast friendly beeraholic subtly charming coffee geek,9,0,8,4,9,6,6,0
twitter lover travel specialist communicator unable type boxing glove pop culture junkie musicaholic,1,5,3,1,3,8,9,0
general beer specialist pop culture enthusiast coffee advocate introvert avid twitter scholar,4,8,9,2,4,4,4,0
zombie nerd analyst introvert coffee expert twitter buff music ninja communicator travel enthusiast hardcore beer practitioner internet lover reader,2,9,9,3,1,4,1,176
food nerd communicator subtly charming pop culture evangelist social medium geek extreme web junkie beer enthusiast entrepreneur devoted twitter guru,0,5,6,9,1,6,5,497
food guru twitter enthusiast beer expert tv fan unapologetic web lover coffee evangelist social medium nerd,9,5,5,7,8,2,3,0
pop culture ninja social medium guru hardcore communicator devoted internet buff travel fan,6,4,7,2,4,3,9,0
coffee fan analyst alcoholaholic zombie practitioner tv specialist beer junkie,1,9,2,0,3,8,9,0
musicaholic food fan writer passionate explorer extreme reader coffee advocate gamer hardcore internet enthusiast zombie aficionado,9,7,8,9,2,5,7,168
introvert beer aficionado extreme gamer alcohol ninja twitter fanatic web maven,9,4,8,9,2,7,3,0
food fan infuriatingly humble alcohol fanatic problem solver coffee evangelist internetaholic,2,7,0,3,7,7,6,0
thinker certified twitter fan web trailblazer award winning bacon nerd evil food guru,4,7,4,9,9,1,9,0
avid reader student web ninja subtly charming alcohol lover social medium enthusiast,4,0,6,9,3,1,1,0
pop culture maven baconaholic social medium evangelist prone fit apathy creator,8,2,3,0,5,5,1,0
hardcore travel nerd student analyst alcoholaholic friend animal everywhere proud internet buff,1,4,0,8,8,1,7,0
travel trailblazer proud reader prone fit apathy internet fanatic creator analyst,7,6,1,0,9,6,6,0
food geek bacon scholar pop culture nerd coffee practitioner alcohol expert organizer,1,6,5,3,6,4,0,0
prone fit apathy food advocate explorer zombie trailblazer passionate music geek coffee ninja,4,9,7,1,8,2,8,0
gamer wannabe beer expert devoted social medium buff food lover analyst student coffee nerd,2,8,5,1,7,3,2,0
beer scholar internet practitioner creator writer devoted entrepreneur web junkie,3,3,5,0,9,6,3,0
social medium specialist writer pop culture scholar troublemaker alcohol evangelist,2,4,1,0,6,0,6,0
student organizer analyst communicator friendly gamer amateur social medium ninja freelance music evangelist,1,3,8,4,0,6,6,0
bacon guru prone fit apathy introvert hipster friendly foodaholic tv ninja beer specialist entrepreneur,3,0,2,4,9,7,2,428
twitter lover entrepreneur thinker writer student explorer friendly problem solver food guru,5,9,7,5,5,7,9,0
travel junkie bacon buff pop culture expert thinker troublemaker internet geek unapologetic coffee evangelist certified zombie fanatic twitter ninja,2,4,1,6,1,4,8,3
social medium fanatic gamer beer trailblazer food guru tv fan twitter scholar,4,2,0,9,1,1,2,0
subtly charming social medium nerd amateur thinker internet guru student pop culture fanatic,6,4,2,9,4,2,4,0
friendly coffee scholar music trailblazer entrepreneur incurable travel lover troublemaker evil food junkie internetaholic tv ninja,7,3,9,0,7,5,8,0
beer fan problem solver friendly bacon guru student writer freelance social medium buff,1,2,1,1,5,7,4,0
tvaholic bacon guru pop culture fanatic zombie maven student coffee lover alcohol aficionado,2,0,1,6,7,0,7,0
food aficionado friend animal everywhere entrepreneur hipster friendly travel fanatic tvaholic beer expert,4,3,8,3,6,2,6,0
lifelong social mediaholic entrepreneur hipster friendly beer fan bacon practitioner communicator,7,6,0,2,3,2,5,0
certified music practitioner typical student creator tv junkie coffee maven,8,2,7,2,5,8,4,0
future teen idol twitter fan internet scholar social medium enthusiast bacon ninja food advocate tv evangelist explorer,8,0,9,2,3,9,1,544
reader total twitter advocate lifelong analyst subtly charming communicator writer,3,2,8,3,6,8,6,0
music nerd bacon aficionado travel enthusiast total internet buff twitteraholic,7,1,0,4,3,1,3,0
zombie expert wannabe reader music geek troublemaker alcohol specialist beer lover avid twitter practitioner,4,0,5,9,7,0,5,0
introvert coffee expert problem solver zombie junkie internet evangelist,7,0,0,2,4,2,6,0
food guru alcohol specialist bacon advocate evil pop culture geek explorer entrepreneur,3,6,7,1,1,6,0,0
reader certified entrepreneur proud coffee maven social medium evangelist alcohol trailblazer music junkie,9,9,3,3,2,4,3,0
prone fit apathy bacon geek evil twitter guru freelance explorer internet fanatic proud reader coffee maven web scholar,4,9,9,9,4,9,9,403
devoted foodaholic certified gamer organizer music buff analyst zombie practitioner,9,1,4,3,5,1,2,0
social medium scholar beer buff music geek evil pop culture specialist introvert,6,1,2,3,7,0,2,0
web specialist troublemaker organizer student social medium fan entrepreneur gamer introvert,8,3,9,2,1,3,3,0
twitteraholic alcohol maven passionate student pop culture buff future teen idol coffee nerd,7,5,1,7,5,7,1,0
student explorer social medium scholar music guru travel junkie food geek communicator,8,3,0,9,8,2,8,0
tv specialist certified introvert travel nerd thinker social medium fan food geek beeraholic writer total reader,7,1,9,0,5,4,9,643
creator social medium fan music evangelist subtly charming pop culture practitioner bacon nerd web fanatic,4,3,2,6,2,9,6,0
pop culture expert organizer zombie aficionado web fanatic music trailblazer communicator,0,1,0,3,2,3,6,0
tv aficionado certified zombie enthusiast infuriatingly humble pop culture buff passionate writer problem solver extreme travel trailblazer,1,6,8,6,9,7,7,0
pop culture junkie subtly charming beeraholic tv trailblazer communicator typical food lover,3,2,8,5,4,9,4,0
alcohol fanatic beeraholic communicator incurable organizer internet expert music scholar,1,0,2,2,3,2,6,0
hardcore music specialist unapologetic problem solver pop cultureaholic award winning beer ninja,7,3,7,7,3,0,9,0
friendly travel nerd food aficionado award winning gamer twitter junkie unapologetic social medium maven,6,0,8,0,1,7,3,0
pop culture evangelist evil writer future teen idol social medium ninja communicator,2,4,1,8,7,4,7,0
student communicator tv junkie freelance alcohol trailblazer bacon fanatic extreme beer enthusiast,1,3,9,9,1,8,3,0
tv aficionado hardcore twitter fanatic incurable alcohol maven introvert web enthusiast organizer unable type boxing glove creator,1,1,1,2,1,7,0,293
gamer zombie practitioner alcohol fan certified bacon geek tv trailblazer creator fall lot,2,9,6,1,2,2,9,0
lifelong coffee guru unapologetic pop cultureaholic food aficionado travel advocate,9,2,8,9,9,7,5,0
zombie aficionado wannabe beer trailblazer friendly communicator internet fan music lover,9,6,0,5,4,8,2,0
internet scholar travel expert coffee evangelist tv ninja communicator twitter trailblazer alcoholaholic,4,6,1,8,5,6,0,0
reader bacon fan web evangelist extreme travel scholar student hipster friendly alcohol trailblazer analyst food guru creator explorer writer,5,9,5,0,7,1,3,448
zombie fan bacon ninja music scholar pop culture maven friendly writer organizer beer evangelist passionate internet nerd,8,3,5,6,3,8,3,0
award winning pop culture fanatic professional problem solver foodaholic beer specialist,6,9,6,7,8,5,2,0
writer music junkie pop culture enthusiast explorer analyst beer advocate web expert,6,2,9,1,7,2,6,0
bacon aficionado travel advocate hipster friendly music evangelist food guru zombie trailblazer extreme coffee practitioner,4,2,2,7,6,6,8,0
lifelong pop culture aficionado alcohol fan zombie trailblazer avid troublemaker twitter specialist tv expert evil coffeeaholic,5,0,4,1,9,9,2,32
zombie lover twitter geek food scholar lifelong communicator beeraholic future teen idol,2,3,5,2,0,2,1,0
organizer internet junkie friendly music enthusiast social medium maven,2,4,6,6,0,9,2,0
pop culture scholar extreme web nerd hardcore beer evangelist total communicator,7,4,7,9,8,5,6,0
beer scholar music geek devoted thinker communicator wannabe problem solver entrepreneur,3,2,5,5,0,0,8,0
food lover alcohol buff amateur zombie advocate social medium fanatic beer nerd bacon ninja,1,5,2,5,6,7,3,0
beer geek general social medium fanatic food guru pop culture trailblazer professional bacon practitioner music advocate zombie maven tv specialist,4,3,2,4,4,1,3,314
student devoted bacon advocate friend animal everywhere communicator freelance creator alcohol aficionado,7,2,5,1,7,0,2,0
introvert alcohol ninja pop culture lover social medium aficionado problem solver,0,2,9,6,4,0,3,0
tv fanatic zombie enthusiast evil twitter practitioner incurable bacon junkie,2,0,2,1,0,6,3,0
incurable twitter enthusiast prone fit apathy baconaholic unapologetic music buff coffee lover communicator problem solver food fan tv expert,2,3,7,1,9,2,7,419
creator coffee enthusiast future teen idol general twitter evangelist incurable tv lover,0,0,6,1,6,3,1,0
avid thinker bacon lover infuriatingly humble music buff introvert organizer problem solver,9,2,6,4,0,2,8,0
twitter geek alcohol fanatic writer wannabe webaholic reader coffee fan,5,9,5,5,3,0,1,0
tv junkie travel maven analyst food lover web trailblazer twitter advocate typical internet aficionado,9,8,5,8,2,4,8,0
passionate introvert friend animal everywhere proud writer communicator organizer hardcore social medium scholar,1,3,4,5,1,6,7,0
certified internet junkie proud travel advocate incurable pop culture maven organizer communicator twitter scholar,5,4,3,6,2,9,2,0
coffee aficionado friendly alcohol evangelist incurable social medium fan communicator total creator hardcore tv buff,3,2,5,6,6,7,4,0
total analyst extreme tv fan gamer problem solver explorer friendly creator web nerd,0,1,6,3,6,3,8,0
music geek food practitioner bacon evangelist pop cultureaholic gamer alcohol enthusiast,7,8,8,1,1,2,6,0
analyst social mediaholic bacon lover freelance internet expert coffee nerd introvert,2,7,1,9,6,1,7,0
hipster friendly tv scholar analyst travel fan friendly music junkie general coffee evangelist,0,1,2,2,8,1,6,0
alcohol enthusiast twitter specialist hardcore internet lover bacon junkie,8,8,9,1,1,4,7,0
avid reader beer evangelist unable type boxing glove writer internet advocate,0,6,0,3,7,8,0,0
food aficionado evil beer practitioner pop culture expert bacon evangelist wannabe thinker lifelong creator,9,8,7,2,1,7,2,0
pop culture geek tv fanatic amateur social medium trailblazer bacon specialist proud travel fan,7,7,0,6,6,3,1,0
alcohol scholar beer buff internetaholic total social medium fan extreme travel maven problem solver web lover typical student,5,2,0,9,4,7,4,596
twitter trailblazer evil alcohol practitioner tv advocate social medium geek coffee ninja,7,5,0,7,1,6,9,0
extreme social medium junkie beer fanatic troublemaker zombieaholic evil tv nerd,0,6,0,7,2,7,4,0
incurable explorer beer ninja music fan devoted problem solver general zombie buff tv fanatic coffee expert,8,4,0,3,2,1,5,169
creator award winning internet enthusiast lifelong travel fan food evangelist,0,1,5,7,1,5,2,0
reader amateur web lover devoted bacon nerd wannabe twitter expert future teen idol music evangelist travel fan,6,7,2,8,8,4,8,353
social medium aficionado student lifelong zombie geek typical pop culture evangelist,7,0,2,7,9,1,6,0
extreme organizer web lover freelance internet geek alcohol scholar communicator writer,8,8,4,3,4,3,0,0
bacon ninja zombie enthusiast gamer beer nerd amateur reader typical creator evil explorer,2,2,8,2,9,3,5,0
gamer general travel enthusiast explorer certified organizer social medium evangelist,3,1,2,1,4,4,2,0
bacon geek analyst creator zombie evangelist incurable coffee fan tv junkie food ninja unapologetic writer,1,0,3,3,1,0,6,184
student award winning food guru creator lifelong troublemaker wannabe social mediaholic,1,0,4,7,4,4,6,0
alcohol junkie total thinker web evangelist food enthusiast music nerd zombie geek,0,8,1,5,6,5,4,0
communicator travelaholic freelance pop culture fanatic infuriatingly humble music specialist introvert writer,5,7,1,4,3,2,8,0
twitter junkie proud internet trailblazer typical problem solver coffee fanatic hipster friendly creator,3,3,4,5,1,5,2,0
coffee geek devoted bacon trailblazer alcohol lover twitter guru explorer food nerd,8,0,1,2,0,8,0,0
hardcore problem solver unapologetic explorer freelance travel guru communicator,8,1,3,9,0,7,9,0
pop culture evangelist thinker creator lifelong music expert tv aficionado zombie maven beeraholic explorer alcohol fan web buff,6,3,0,2,2,7,5,17
twitter aficionado internet evangelist creator bacon ninja certified web fanatic food nerd hardcore music lover extreme introvert,2,6,0,5,1,5,3,269
bacon lover web fanatic travel enthusiast coffee fan explorer beer maven friendly pop culture expert,0,3,1,6,4,8,6,0
unapologetic entrepreneur problem solver lifelong coffee buff social medium maven professional thinker zombie aficionado,2,1,5,0,5,1,7,0
beer fanatic alcohol lover infuriatingly humble tvaholic music evangelist zombie geek,6,3,6,3,5,2,0,0
thinker troublemaker hipster friendly twitter maven evil music fanatic tv guru,3,8,9,7,7,4,3,0
entrepreneur social medium fanatic tv junkie coffee aficionado extreme bacon lover,1,0,0,8,2,8,4,0
twitter evangelist hardcore entrepreneur internet advocate bacon enthusiast evil music aficionado tv specialist coffee lover,8,1,2,9,3,0,9,0
award winning foodaholic problem solver alcohol advocate devoted music junkie introvert beer evangelist,3,5,1,3,3,5,6,0
creator zombie nerd tv ninja freelance twitter maven writer music specialist unapologetic thinker,0,6,3,9,8,2,4,0
alcohol expert lifelong troublemaker travel aficionado creator web nerd avid introvert beer trailblazer tv scholar social medium fan,5,7,2,7,1,8,5,609
zombie geek organizer friendly food scholar extreme reader twitter expert devoted music ninja web enthusiast,2,8,7,3,2,0,8,0
tv buff beer advocate future teen idol problem solver student internet junkie twitter geek organizer analyst coffee evangelist food enthusiast,3,4,4,1,7,0,3,262
web fan student bacon trailblazer analyst twitter evangelist alcohol scholar hardcore zombie maven food aficionado,8,9,1,3,3,4,5,0
passionate coffee ninja music scholar hardcore pop culture enthusiast bacon expert food nerd,6,9,8,6,2,2,1,0
twitteraholic total introvert internet aficionado web maven award winning beer trailblazer,7,8,9,8,8,4,4,0
incurable social medium advocate beer specialist student analyst organizer lifelong introvert twitter lover avid troublemaker,4,1,2,7,1,5,1,0
writer social medium junkie bacon fanatic incurable tv fan evil food evangelist music specialist,9,1,6,5,1,4,2,0
devoted alcohol fanatic award winning pop culture geek food advocate beer lover,3,7,5,4,9,0,9,0
travel evangelist thinker coffee nerd entrepreneur friendly tv aficionado amateur alcohol fanatic organizer,8,7,9,0,0,9,8,0
coffee fanatic lifelong troublemaker travel maven bacon guru web geek proud pop culture advocate social medium ninja,3,9,4,4,9,5,2,438
professional zombie advocate total introvert twitter fan creator social medium fanatic food expert bacon ninja writer,9,9,8,5,5,8,6,0
student entrepreneur internet practitioner beer advocate social medium expert travel nerd,5,2,1,3,8,5,2,0
coffee evangelist food fan tv enthusiast problem solver passionate web trailblazer creator,7,8,3,3,4,4,7,0
tv enthusiast bacon advocate pop culture evangelist subtly charming explorer beer fanatic twitter junkie analyst friendly music guru,2,6,5,7,1,9,7,60
music nerd professional travel maven communicator student hardcore pop cultureaholic,0,5,6,6,8,0,6,0
avid web practitioner tv specialist zombie aficionado alcohol lover freelance analyst,7,7,7,6,7,9,3,0
food practitioner proud bacon scholar pop culture lover passionate internet fanatic,2,6,0,3,3,5,6,0
problem solver food maven twitter evangelist social medium buff web expert student,7,8,6,0,4,8,5,0
internet trailblazer writer typical student introvert music fanatic professional troublemaker,6,5,1,5,4,3,2,0
social medium fanatic subtly charming troublemaker award winning travel ninja alcohol trailblazer,5,4,2,4,8,0,7,0
music fanatic reader wannabe thinker organizer tv practitioner passionate travel scholar writer zombie maven,4,7,4,5,9,9,3,0
friendly communicator troublemaker twitter fanatic proud social medium practitioner incurable food aficionado,1,0,2,9,0,8,8,0
