Bios,Movies,TV,Religion,Music,Sports,Books,Politics,Cluster #
internet enthusiast web ninja thinker food buff social medium maven incurable music expert creator tv scholar,1,4,7,1,7,3,5,0
beer evangelist friend animal everywhere food geek certified zombie expert passionate gamer,4,4,9,0,7,0,2,0
alcohol lover coffee practitioner music evangelist problem solver creator gamer thinker,3,7,7,2,8,4,5,0
passionate beer practitioner total communicator creator organizer twitter guru travel expert,3,8,6,9,4,5,3,0
friendly alcohol scholar internetaholic beer fanatic future teen idol food maven tv junkie zombie nerd passionate bacon buff,1,9,9,5,9,5,6,206
internet expert general coffee lover music advocate incurable travel maven alcohol nerd,9,0,0,8,2,5,2,0
hardcore introvert beer lover amateur twitter maven infuriatingly humble gamer music trailblazer coffee evangelist,6,9,5,7,3,4,3,0
music trailblazer introvert beer aficionado food lover communicator web advocate creator,2,1,4,1,7,8,0,0
analyst thinker friend animal everywhere food expert devoted writer organizer,2,7,3,6,2,0,1,0
student hipster friendly music advocate zombie geek web buff friend animal everywhere,6,2,3,9,3,8,4,0
troublemaker alcohol practitioner travel buff evil social medium fan bacon guru beer evangelist,3,4,9,5,8,9,1,0
subtly charming web enthusiast writer unable type boxing glove,6,4,5,1,1,4,3,0
analyst zombie evangelist general beer advocate alcohol buff writer typical food geek,0,5,6,2,7,0,9,0
food fanatic general gamer organizer twitter trailblazer incurable beer maven hardcore social medium specialist troublemaker,9,7,5,9,5,1,4,0
friendly analyst lifelong beer fan introvert bacon guru travelaholic coffee scholar web lover,8,9,9,7,1,0,0,0
alcohol practitioner general creator coffee nerd professional tv fanatic freelance writer twitter scholar wannabe zombieaholic,5,4,5,4,9,8,1,0
music trailblazer friend animal everywhere extreme twitter buff zombie evangelist bacon fan,4,2,9,0,0,9,1,0
passionate thinker social medium maven proud tv evangelist bacon specialist music buff fall lot,9,3,8,0,5,6,9,0
zombieaholic communicator hardcore travel enthusiast bacon specialist alcohol guru,8,9,0,6,1,8,5,0
creator certified problem solver travel advocate reader troublemaker introvert,9,5,5,4,4,7,4,0
alcohol buff student friendly pop culture specialist social medium evangelist problem solver travel fanatic,7,8,9,8,3,3,5,0
gamer communicator coffee buff devoted entrepreneur freelance alcohol advocate troublemaker,7,8,7,1,6,6,4,0
writer proud thinker tv maven food scholar bacon aficionado twitter practitioner introvert,7,2,6,7,7,4,0,0
pop culture geek social medium fan alcohol fanatic organizer explorer zombie practitioner,7,2,0,0,0,5,7,0
lifelong web junkie unapologetic alcohol scholar pop culture ninja social medium maven future teen idol,2,1,6,3,3,4,7,0
infuriatingly humble beeraholic bacon guru social medium fanatic extreme reader,0,8,1,9,7,8,0,0
web fanatic beer geek alcohol junkie zombie advocate bacon scholar analyst twitter aficionado,1,3,3,0,3,9,1,0
food fanatic extreme twitter geek pop culture enthusiast communicator friend animal everywhere entrepreneur wannabe tv advocate,3,8,4,9,6,5,0,0
fall lot creator beer evangelist typical internet advocate coffee maven avid web enthusiast amateur alcohol lover,9,7,1,6,6,8,8,210
beer scholar alcohol geek tv enthusiast zombie fanatic freelance food guru twitter junkie music buff,0,3,1,5,7,4,6,0
student tv specialist beer geek music practitioner twitter expert coffee nerd web ninja,9,4,9,1,2,4,1,0
freelance coffee lover organizer web nerd social medium fan proud pop culture buff,6,6,6,7,5,4,8,0
amateur music maven zombie buff devoted beer advocate bacon expert web ninja evil tv practitioner,7,6,9,9,3,3,9,0
entrepreneur unable type boxing glove unapologetic food trailblazer problem solver,7,8,0,1,6,0,3,0
writer internet practitioner coffee evangelist alcohol junkie total zombie guru,6,1,2,9,1,8,4,0
creator general music enthusiast amateur gamer freelance web lover introvert,9,5,8,4,0,4,9,0
general writer extreme food maven travel fanatic passionate beer specialist total organizer,4,7,3,2,7,2,8,0
beer guru thinker wannabe bacon ninja writer web advocate travel evangelist,4,0,8,6,8,2,0,0
analyst incurable pop culture junkie coffee evangelist thinker certified internet buff,4,9,5,5,1,2,7,0
beer ninja wannabe twitter expert analyst unable type boxing glove problem solver,8,4,6,2,4,3,8,0
devoted music practitioner unapologetic analyst bacon junkie social medium lover,0,3,7,9,7,9,9,0
proud social medium specialist organizer devoted travel practitioner tv junkie hardcore troublemaker reader,1,4,8,8,1,1,6,0
problem solver devoted food fan twitter buff zombie maven travel geek introvert,8,1,6,0,8,7,7,0
food buff internet geek prone fit apathy hipster friendly alcoholaholic,3,7,0,1,8,4,0,0
lifelong travel scholar coffee specialist organizer twitter evangelist pop culture enthusiast,6,0,5,7,1,7,9,0
proud twitter evangelist web fanatic travel enthusiast future teen idol thinker extreme internet lover hardcore coffeeaholic,3,0,1,8,4,7,8,0
tv maven gamer unable type boxing glove hardcore travel geek certified analyst alcohol specialist,8,4,3,2,2,9,5,0
introvert unable type boxing glove music fan twitter aficionado explorer reader,8,2,0,3,9,0,7,0
zombie geek thinker troublemaker proud creator music expert unapologetic alcohol scholar,9,6,2,1,4,2,4,0
social medium ninja extreme music practitioner travel specialist analyst internet lover,0,0,7,6,4,6,5,0
organizer travel guru web specialist problem solver student wannabe creator award winning beer lover coffee nerd,2,8,3,0,4,8,8,0
bacon expert travel guru tv buff avid zombie junkie lifelong problem solver gamer web fan,2,8,4,5,9,0,7,0
travel aficionado friendly social medium guru general internet specialist student writer problem solver,5,0,0,2,2,6,8,0
travelaholic coffee nerd alcohol junkie friendly twitter aficionado wannabe beer fanatic,3,5,4,2,3,6,6,0
web aficionado organizer coffee geek avid beer guru certified creator twitter expert,3,5,0,1,1,3,7,0
amateur alcohol fan zombie fanatic food enthusiast typical tv maven twitteraholic pop culture advocate coffee guru web ninja,0,8,9,1,6,7,5,0
coffee geek gamer evil baconaholic hipster friendly communicator tv trailblazer,2,2,5,7,9,2,0,0
award winning coffee practitioner travel scholar professional beer fan internet junkie twitter nerd certified music maven,7,0,3,5,8,2,1,0
beer guru freelance organizer internet aficionado bacon enthusiast tv expert troublemaker introvert social medium practitioner avid alcohol advocate,0,8,7,9,8,5,7,535
internet junkie hardcore analyst gamer web fanatic avid beer enthusiast unable type boxing glove,8,8,7,3,9,5,2,0
analyst student web maven hardcore zombie fanatic music fan freelance alcohol practitioner,3,9,9,9,7,9,1,0
writer tv ninja lifelong zombie trailblazer troublemaker pop culture scholar analyst,5,6,8,2,2,1,2,0
zombie enthusiast fall lot student hardcore food specialist alcohol evangelist web scholar beer guru entrepreneur reader internet ninja gamer,3,4,1,1,6,3,8,252
zombie fanatic entrepreneur lifelong gamer beer buff passionate pop culture evangelist coffee trailblazer music geek travel ninja,9,2,1,1,3,4,2,0
hipster friendly zombie scholar total twitter practitioner internet expert pop culture fan,3,8,7,7,2,5,9,0
wannabe web ninja extreme music lover hardcore tv maven avid beer junkie introvert evil travel practitioner,3,4,9,2,3,2,0,0
coffee trailblazer certified tv buff thinker alcohol fanatic beer practitioner incurable zombie maven,4,5,8,6,2,4,0,0
lifelong music advocate tv nerd evil reader twitter evangelist general entrepreneur social medium fanatic wannabe travel aficionado,3,5,1,6,0,6,0,525
avid coffee evangelist travel enthusiast passionate social medium fanatic problem solver,0,5,8,6,0,6,0,0
zombie nerd fall lot extreme creator unable type boxing glove web lover,6,4,9,2,1,5,9,0
extreme music fanatic bacon advocate social medium enthusiast prone fit apathy,5,0,0,9,5,1,3,0
reader wannabe pop culture maven lifelong music geek general bacon evangelist,5,7,2,9,9,6,3,0
hardcore food nerd communicator travel practitioner bacon evangelist general zombie geek,7,3,1,7,7,6,8,0
award winning food nerd pop culture fan tv enthusiast beer fanatic communicator explorer web ninja,4,2,8,7,2,6,4,0
social medium junkie introvert internet guru web practitioner tv specialist bacon expert,5,5,1,7,7,0,4,0
organizer music buff student introvert subtly charming explorer creator alcohol advocate,1,6,6,6,1,3,7,0
tv trailblazer social medium geek passionate internet buff pop culture evangelist zombie guru,9,4,9,1,9,2,0,0
organizer entrepreneur total alcohol trailblazer web advocate unable type boxing glove analyst,9,2,8,7,9,5,6,0
tv scholar pop culture ninja music specialist travel aficionado professional social medium fanatic alcohol junkie web buff,4,7,8,5,5,4,3,0
beer trailblazer creator entrepreneur travel evangelist music ninja twitter lover food aficionado baconaholic,3,6,7,3,2,7,1,0
gamer avid introvert music junkie friendly entrepreneur reader organizer student alcohol lover,8,6,0,7,4,2,8,0
twitter geek friend animal everywhere professional zombie evangelist analyst tv guru web trailblazer extreme pop culture fanatic,6,7,1,1,2,2,7,38
writer music maven pop culture junkie analyst troublemaker avid beer trailblazer,5,1,8,2,6,6,8,0
friend animal everywhere typical beer guru evil bacon evangelist web lover reader,7,9,3,8,5,8,4,0
beer trailblazer social medium fanatic hipster friendly student music lover writer future teen idol,4,5,6,8,5,6,1,0
problem solver writer introvert professional tv ninja unapologetic web lover total food fan,5,0,6,2,4,0,9,0
internet nerd tv fanatic entrepreneur lifelong pop culture junkie zombie advocate,9,4,7,5,7,0,4,0
social medium fanatic prone fit apathy freelance gamer pop culture practitioner,6,0,9,7,9,5,5,0
wannabe music lover gamer twitter geek subtly charming food maven proud social medium nerd,7,7,8,2,7,3,7,0
proud analyst music junkie beer fan pop culture maven subtly charming zombie lover friend animal everywhere amateur internet nerd,4,7,3,1,3,9,0,25
bacon maven general writer entrepreneur alcohol specialist music fan zombie buff devoted student extreme analyst web aficionado,2,9,7,4,3,2,0,175
hipster friendly social medium advocate zombie enthusiast internet maven,4,2,3,2,6,7,2,0
student gamer avid tv practitioner freelance food nerd organizer thinker introvert evil communicator twitter ninja music evangelist coffee fan,6,2,5,8,9,3,9,279
zombieaholic tv maven alcohol buff travel fan organizer web advocate pop culture fanatic,4,9,6,3,5,2,5,0
general web evangelist introvert gamer unapologetic reader passionate communicator,3,9,2,0,4,6,4,0
internet nerd lifelong web fanatic coffee lover professional troublemaker introvert,5,0,5,5,6,0,8,0
future teen idol internet buff hipster friendly creator alcohol fanatic professional gamer,8,1,8,9,7,2,1,0
internet guru bacon geek web aficionado alcohol junkie organizer passionate troublemaker twitter expert,8,4,0,8,3,7,1,0
pop culture evangelist tv fanatic internet geek explorer problem solver general zombie buff,3,8,1,7,9,3,9,0
tv fan web scholar music enthusiast amateur alcoholaholic bacon specialist,1,7,8,9,2,9,0,0
food fanatic hardcore alcohol specialist subtly charming writer twitter aficionado,3,8,2,7,1,3,5,0
internet specialist travel trailblazer problem solver wannabe twitter fanatic web geek social mediaholic amateur reader coffee junkie,3,5,1,0,4,4,9,0
problem solver beer expert typical food evangelist passionate baconaholic student internet fan,6,3,7,0,4,3,6,0
tv practitioner twitter ninja avid coffee nerd music enthusiast social medium trailblazer,1,5,6,0,5,4,8,0
coffee buff wannabe thinker general explorer musicaholic tv trailblazer internet guru avid twitter fanatic unapologetic alcohol expert,8,8,2,6,3,7,0,224
alcohol evangelist reader twitter practitioner zombie expert food geek pop culture scholar,4,3,6,9,6,6,2,0
incurable analyst lifelong travel aficionado evil gamer wannabe food fanatic music evangelist,8,9,8,0,9,7,3,0
unapologetic web guru pop culture evangelist tv lover internet fanatic lifelong music fan,2,1,7,8,2,8,7,0
social medium ninja food expert avid thinker friendly entrepreneur music aficionado creator,0,3,7,8,3,1,6,0
travel aficionado professional problem solver music scholar hardcore pop culture fanatic,6,1,2,9,3,7,3,0
coffee aficionado amateur music nerd troublemaker web scholar devoted problem solver friend animal everywhere,1,1,9,4,7,6,3,0
internetaholic music buff troublemaker thinker travel geek reader tv advocate hipster friendly explorer,2,1,4,9,0,5,9,0
lifelong internetaholic student wannabe tv specialist web scholar coffee lover,5,3,3,6,6,8,9,0
music nerd web enthusiast general tv aficionado beer junkie future teen idol introvert,5,9,0,6,6,7,9,0
introvert social medium fanatic twitter nerd alcohol guru coffee trailblazer zombie buff web ninja thinker internet enthusiast,1,9,6,5,2,1,5,0
twitter trailblazer thinker friendly analyst fall lot reader introvert social medium buff food advocate bacon junkie,9,6,4,7,8,6,8,0
web fanatic social medium geek pop culture aficionado music nerd infuriatingly humble organizer,8,8,2,4,9,6,1,0
problem solver organizer creator avid pop cultureaholic tv advocate web specialist food scholar,4,3,0,6,9,3,6,0
alcohol buff friendly beeraholic hipster friendly music fanatic entrepreneur typical introvert tv maven,5,8,0,8,1,9,1,0
internet aficionado proud beer maven wannabe food evangelist total zombie specialist student entrepreneur,3,6,1,2,5,9,9,0
extreme bacon specialist devoted writer alcohol advocate pop culture expert communicator,0,1,2,6,1,8,3,0
zombie fan devoted music fanatic beer lover bacon ninja introvert hardcore explorer,6,0,2,4,3,9,7,0
music trailblazer travel fanatic subtly charming introvert explorer passionate entrepreneur,2,7,3,2,5,8,9,0
social medium trailblazer bacon lover travel maven extreme food ninja coffee guru,6,2,9,2,2,3,5,0
travel evangelist webaholic social medium expert coffee enthusiast entrepreneur creator tv advocate introvert,7,1,3,1,5,1,8,0
travel trailblazer coffee geek writer social medium fan bacon expert food guru,7,3,7,7,5,6,9,0
amateur web practitioner social medium geek problem solver internet enthusiast beer fan pop culture advocate,7,5,1,2,6,1,1,0
web geek coffee fan prone fit apathy infuriatingly humble creator unable type boxing glove,2,8,8,7,6,3,6,256
zombie advocate reader wannabe web fanatic troublemaker creator professional internet fan,1,6,8,2,1,4,6,0
thinker troublemaker writer unapologetic zombie advocate tv buff devoted coffee fan internet fanatic pop culture maven bacon ninja,8,0,0,8,2,3,2,2
music junkie travel practitioner hipster friendly creator beer specialist troublemaker wannabe reader,0,3,4,5,9,4,0,0
twitter geek coffee aficionado music lover certified web guru general social medium practitioner,1,3,6,4,2,4,7,0
troublemaker alcohol advocate coffee specialist tv practitioner award winning web fanatic,8,7,0,7,5,3,9,0
typical zombie advocate creator certified bacon fanatic problem solver thinker subtly charming writer organizer,6,9,4,3,6,6,4,0
devoted pop culture ninja hardcore internet guru unable type boxing glove web buff,9,7,3,4,3,0,7,0
professional bacon scholar gamer total zombie specialist lifelong web evangelist food lover music buff alcoholaholic thinker writer amateur introvert,0,0,3,4,8,0,7,334
thinker subtly charming twitter buff explorer troublemaker internet ninja social medium fanatic amateur creator zombie aficionado,0,2,7,0,6,7,5,532
troublemaker pop culture junkie twitter fanatic passionate travel nerd foodaholic,4,5,2,9,0,3,0,0
alcohol maven bacon ninja friendly organizer web specialist passionate student twitter guru,4,9,2,2,5,3,9,0
friendly tv junkie typical analyst web evangelist coffee specialist zombie maven communicator food fanatic,5,2,5,5,9,4,0,0
thinker music geek amateur web junkie food practitioner communicator entrepreneur,3,4,0,9,4,3,9,0
total internet fan award winning twitter trailblazer passionate coffee scholar explorer bacon practitioner troublemaker,7,1,1,0,9,7,6,0
web buff entrepreneur zombie evangelist lifelong internet maven evil twitter fanatic problem solver typical alcohol fan,7,5,5,1,7,9,1,158
social medium trailblazer twitter fanatic problem solver pop cultureaholic alcohol aficionado coffee ninja,4,2,1,0,8,1,5,0
total creator evil internet specialist lifelong twitter enthusiast bacon advocate introvert,4,9,5,9,6,8,7,0
twitter expert communicator typical thinker devoted web aficionado travel guru,9,6,8,1,6,3,5,0
music trailblazer web lover proud travel junkie problem solver evil reader bacon guru,7,7,2,0,9,1,9,0
friend animal everywhere internet specialist wannabe introvert coffee maven twitter geek music guru,0,8,7,1,1,5,8,0
incurable coffee advocate writer organizer infuriatingly humble social medium enthusiast,3,9,8,8,3,4,2,0
unapologetic tv lover food specialist reader infuriatingly humble thinker passionate coffee fan creator explorer web advocate,0,8,9,2,6,8,6,313
analyst award winning internet fanatic freelance troublemaker tv trailblazer coffee aficionado,6,8,9,0,1,0,5,0
introvert travel fanatic tv specialist social medium nerd music lover internet evangelist,0,7,5,8,2,3,7,0
lifelong bacon aficionado music trailblazer gamer general coffee fanatic creator,2,8,1,3,4,7,5,0
professional internet fanatic explorer travel enthusiast infuriatingly humble web buff social medium practitioner,6,9,8,2,3,4,2,0
general pop culture junkie travel expert social medium guru creator writer extreme beer scholar,3,1,4,2,3,3,8,0
music ninja web fanatic hipster friendly coffee trailblazer organizer internet practitioner lifelong tv fan,4,7,2,6,7,0,0,0
wannabe travel junkie beer fan evil web ninja introvert extreme coffee trailblazer,1,9,2,2,5,9,1,0
foodaholic avid troublemaker student general beer maven pop culture fan creator web buff,1,0,9,6,5,7,9,0
devoted web buff gamer introvert food fanatic twitter geek troublemaker lifelong travel ninja,3,6,7,4,1,4,2,0
food enthusiast coffee trailblazer explorer thinker internet fanatic communicator social medium buff,0,2,0,3,0,8,0,0
evil alcohol scholar lifelong social medium advocate infuriatingly humble entrepreneur hardcore communicator food nerd amateur internet evangelist,3,1,4,7,8,7,7,540
reader professional music evangelist introvert bacon specialist,5,0,8,6,1,7,7,0
web fanatic organizer twitter nerd coffee evangelist travel scholar,5,8,4,6,8,1,0,0
alcohol buff proud music aficionado internet advocate reader typical writer,2,6,4,4,6,4,1,0
pop culture enthusiast communicator bacon junkie extreme alcohol fanatic tvaholic zombie practitioner gamer,2,0,2,8,6,9,5,0
music fan certified zombie enthusiast beer geek alcohol trailblazer web fanatic,2,3,6,3,5,9,7,0
travel scholar analyst total web enthusiast music practitioner food maven evil beer advocate alcohol nerd twitter ninja creator,9,8,2,7,3,4,0,190
beer buff problem solver freelance music enthusiast analyst twitter geek general gamer internet junkie,1,0,4,8,0,6,9,0
travel aficionado unapologetic alcohol evangelist web practitioner total zombie lover analyst,2,2,4,8,9,1,2,0
thinker unapologetic writer gamer alcohol maven food buff bacon enthusiast coffee specialist troublemaker entrepreneur beer junkie,8,4,7,0,4,6,8,0
food guru analyst coffee nerd explorer hipster friendly web practitioner,0,9,3,7,0,3,2,0
food guru troublemaker music ninja writer general beer geek thinker fall lot,6,1,9,8,6,4,8,0
zombie evangelist internet ninja travel expert award winning beer scholar unapologetic communicator tv enthusiast,0,8,7,4,6,3,2,0
wannabe bacon specialist food maven certified student pop culture ninja twitter fanatic,8,2,0,7,6,4,6,0
devoted zombie buff beer nerd pop culture fanatic unapologetic writer foodaholic,6,0,9,0,1,5,7,0
wannabe bacon maven infuriatingly humble beer ninja social medium aficionado zombie buff pop culture specialist,8,2,5,7,3,2,5,0
subtly charming travel fan web scholar pop culture guru bacon expert hardcore problem solver zombie maven,6,4,2,3,5,0,9,0
writer entrepreneur lifelong food scholar music fanatic explorer twitter geek creator,9,8,9,4,0,2,3,0
writer friendly social mediaholic thinker typical internet fanatic communicator freelance tv practitioner,7,1,6,4,0,2,5,0
entrepreneur freelance tv geek prone fit apathy lifelong coffee junkie social medium lover food nerd certified alcohol buff,2,5,3,9,5,3,6,597
gamer lifelong beer expert tv advocate freelance explorer student thinker internet lover friendly zombie guru future teen idol,7,7,7,3,6,8,5,309
coffee guru hipster friendly entrepreneur fall lot communicator food geek,0,0,4,0,1,2,3,0
coffee fanatic food geek creator future teen idol reader proud troublemaker,7,1,2,0,1,5,9,0
writer general introvert avid travel lover professional alcohol geek web junkie,4,5,7,5,0,6,6,0
wannabe music practitioner devoted social medium lover travel fanatic tv enthusiast zombieaholic reader evil food specialist,5,7,9,9,1,6,1,602
bacon fanatic social mediaholic travel evangelist problem solver creator alcohol enthusiast friendly food nerd,9,1,2,0,2,6,6,0
freelance pop culture geek coffee trailblazer music fan introvert communicator bacon advocate food practitioner alcohol scholar,5,9,4,4,7,4,9,0
award winning alcohol practitioner twitter trailblazer passionate beer buff bacon scholar,0,8,6,8,1,7,8,0
zombie buff coffee aficionado food fan beer geek hipster friendly tv fanatic general social medium ninja creator,2,4,2,7,0,7,3,0
music specialist certified alcohol ninja friendly beer fanatic problem solver analyst,6,3,6,6,8,8,0,0
explorer social medium guru wannabe food scholar bacon advocate alcohol nerd coffee evangelist,5,4,2,2,5,9,6,0
zombie trailblazer subtly charming creator incurable reader twitter evangelist travel ninja internet scholar coffee aficionado,0,5,1,4,4,9,4,0
creator travel junkie troublemaker fall lot avid pop culture practitioner analyst wannabe music expert hardcore bacon enthusiast,2,8,1,1,8,0,8,113
reader twitter ninja musicaholic gamer unable type boxing glove incurable student thinker,5,4,9,1,2,5,2,0
creator travel lover professional twitter junkie coffee guru tv fan zombie practitioner writer,0,5,6,0,5,6,9,0
social medium buff tv scholar organizer award winning travel guru problem solver avid creator entrepreneur,2,0,6,7,5,3,2,0
freelance zombie geek alcohol expert reader bacon fanatic creator entrepreneur twitter junkie,7,5,3,0,5,9,6,0
webaholic food practitioner organizer pop culture junkie thinker beer lover,0,0,9,2,4,5,6,0
alcohol fanatic hardcore twitter advocate zombie guru internet maven coffee expert entrepreneur social medium trailblazer,7,5,7,0,3,5,8,0
unable type boxing glove proud tv geek friendly pop culture ninja,0,0,1,6,7,1,0,0
music buff total tv guru friendly social medium ninja zombie expert bacon evangelist web fan alcohol aficionado,6,0,4,3,2,4,7,523
hardcore social mediaholic award winning food aficionado subtly charming twitter fan travel fanatic writer,5,6,9,6,2,4,9,0
alcohol junkie writer bacon enthusiast reader pop culture practitioner tv buff food fanatic music geek wannabe zombie fan,0,5,3,1,2,3,9,0
wannabe coffee fanatic extreme communicator internet nerd writer passionate problem solver music enthusiast,2,8,3,6,4,7,5,0
problem solver zombie expert professional tv junkie analyst coffee fanatic food lover bacon enthusiast thinker,8,5,3,9,3,8,7,0
music geek passionate bacon advocate twitter fan coffee enthusiast travel specialist hardcore zombie aficionado internet ninja,5,4,7,7,3,8,6,0
proud twitter expert writer social medium lover web advocate reader gamer problem solver,4,6,4,9,2,3,9,0
zombie maven total entrepreneur passionate bacon geek pop culture evangelist twitteraholic,3,4,1,7,1,9,9,0
evil introvert communicator bacon fan coffee enthusiast troublemaker analyst,5,4,7,7,5,0,7,0
entrepreneur organizer gamer incurable internet geek creator coffee maven twitter lover problem solver unapologetic introvert,4,5,1,8,7,3,0,0
pop culture fan passionate thinker problem solver total entrepreneur incurable travel enthusiast student,9,6,1,7,3,7,5,0
alcohol maven passionate internet practitioner web junkie beer enthusiast introvert travel evangelist zombie expert proud reader music fanatic,8,3,6,0,9,2,5,157
beer ninja zombie fanatic proud travel junkie tv scholar writer web practitioner,1,3,6,5,1,2,0,0
creator pop culture scholar twitter fan devoted explorer internet specialist music expert general foodaholic beer trailblazer bacon enthusiast,6,0,9,4,3,3,0,100
total introvert subtly charming beer guru zombie geek music ninja bacon fan social mediaholic food practitioner avid twitter expert,1,0,1,4,1,2,6,502
reader organizer social medium scholar avid alcohol fanatic zombie specialist tv fan twitteraholic,9,4,3,6,3,7,2,0
internet trailblazer pop culture fanatic award winning bacon expert extreme music buff,1,7,0,5,3,2,1,0
bacon trailblazer web buff pop culture evangelist tv ninja future teen idol beeraholic,7,2,5,8,2,1,9,0
tv ninja beer fanatic reader pop culture guru internet enthusiast,4,7,4,4,4,7,9,0
professional music trailblazer pop culture fanatic twitter geek amateur alcohol buff,6,8,6,9,4,0,8,0
freelance tv advocate wannabe travel geek explorer analyst social medium buff zombie trailblazer,8,9,8,6,3,4,8,0
explorer amateur alcohol maven bacon evangelist subtly charming internet expert proud introvert,6,2,2,6,0,9,9,0
typical beer fanatic hipster friendly writer alcohol nerd social medium aficionado,1,4,8,2,5,3,0,0
evil creator passionate zombie advocate writer entrepreneur thinker food nerd pop culture buff total explorer,7,8,5,6,2,2,7,0
twitter junkie entrepreneur fall lot coffee maven unapologetic pop culture geek,9,1,3,1,6,6,3,0
subtly charming twitter fan thinker reader food expert amateur writer infuriatingly humble pop culture fanatic,2,0,0,0,4,3,5,0
